review_id,app_name,rating,review_date,review_text_original,review_text_clean,aspect_category,sentiment
3551a401-98ff-48e1-a64c-bab0b1cb0f27,VENTENY,5,,"Aplikasi sangat bagus,bisa buat semua kebutuhan digital,sering ada promo juga,sukses terus kedepannya😍","aplikasi sangat bagus,bisa untuk semuanya kebutuhan digital,sering ada promo juga,sukses terus kedepannya",Kemudahan Penggunaan,positif
9ab735dc-5b09-4d2d-be41-d72db4e9d0e3,VENTENY,5,,Saya senang punya aplikasi Venteny terimakasih Venteny,saya senang punya aplikasi venteny terima kasih venteny,Kemudahan Penggunaan,positif
119ef96c-b41a-4825-adde-1db724a04e05,VENTENY,5,,Aplikasinya sangat bermanfaat,aplikasinya sangat bermanfaat,Kemudahan Penggunaan,positif
3278f592-5ee9-495a-8dfd-14567e1b16ae,VENTENY,5,,Aplikasinya mempermudah employee dalam transaksi..,aplikasinya mempermudah employee di dalam transaksi..,Kemudahan Penggunaan,positif
8d317239-7281-440c-9ce0-9abbbb8c9fd4,VENTENY,5,,Aplikasinya sangat membantu,aplikasinya sangat membantu,Kemudahan Penggunaan,positif
a4a358b3-bd35-4735-b97b-46cadcc02725,VENTENY,5,,Okeeeeey Sangat membantu para pekerja,okeey sangat membantu para pekerja,Kemudahan Penggunaan,positif
f7f4c8f5-b849-4f29-9982-5ee448d02d19,VENTENY,5,,Wahhh aplikasinya bagus!!,wah aplikasinya bagus!!,Kemudahan Penggunaan,positif
c8bfbc7d-42a3-4f70-bf24-d750ccf1f65f,VENTENY,5,,EDIT : Tiap trouble di aplikasi venteny ... kontak CSnya langsung gercep dibenahin. Makasih banyak. Sukses terus.,edit : tiap trouble di aplikasi venteny .. menghubungi csnya segera cepat tanggap dibenahin. terima kasih banyak. sukses terus.,Kemudahan Penggunaan,positif
c3e59cd9-0444-4c3a-8066-2c7885401b3f,VENTENY,5,,Aplikasi nya sangat membantu sekali,aplikasi ya sangat membantu sekali,Kemudahan Penggunaan,positif
731a76ca-9ee1-49af-995c-867557e8bcbc,VENTENY,5,,"Baru beberapa bulan saya install, aplikasinya oke banget sih. Saran aja ditambahin promo promonya","baru beberapa bulan saya install, aplikasinya baik banget sih. saran saja ditambahin promo promonya",Kemudahan Penggunaan,positif
9ebfad74-975e-481d-a246-dabb2e453134,VENTENY,5,,gimana cara top ovo udah terhubung di akun dana saya,bagaimana cara bagus ovo sudah terhubung di akun pengguna dana saya,Kemudahan Penggunaan,positif
e2f64bde-4f27-42d8-a9b0-bc0893c89d4f,VENTENY,5,,LUAR BIASA Maju terus VENTENY KUU,luar biasa maju terus venteny ku,Kemudahan Penggunaan,positif
ebf6a73d-f51f-469f-b364-f8f6c12de71e,Wagely,1,,"Wagely sangat membantu keuangan karyawan, tapi sayang ada pihak2 yg mengambil keuntungan dengan menambahkan biaya pemotongan lagi yg sangat besar, stelah dihitung2 seluruh biaya ini tak beda jauh dari bunga di pinjol...saya harap wagely bisa menegaskan aturan2nya sesuai tujuannya untuk membantu karyawan menghidarkan karyawan dari jeratan pinjol.. Trimakasih mohon tindak lanjutnya demi keredibilitas apk pinjol...","wagely sangat membantu keuangan karyawan, tapi sayang ada pihak2 yang mengambil keuntungan dengan menambahkan biaya pemotongan lagi yang sangat besar, setelah dihitung2 seluruh biaya ini tak berbeda jauh dari suku bunga di pinjol..saya harap wagely bisa menegaskan aturan2nya sesuai tujuannya untuk membantu karyawan menghidarkan karyawan dari jeratan pinjol.. terima kasih mohon tindak lanjutnya demi keredibilitas aplikasi pinjol..",Biaya/Potongan,negatif
d6b0eb3b-832e-41c7-bc70-309887242e35,Wagely,1,,"Kecewa banget deh, bunganya naik mulu yg awalnya 30rb sekarang jadi 50rb, gila niat banget meres orang kayak pinjol","kecewa banget deh, bunganya menaiki melulu yang awalnya 30rb sekarang jadi 50rb, gila niat banget meres manusia seperti pinjol",Biaya/Potongan,negatif
263a4735-3dba-4f05-a459-f1e6801059b8,Wagely,1,,Kebanyakan bunga🌺🌻🌹🌷 Dan yang bikin pegel hati Klamaan nunggu saldonya ag banyak,kebanyakan suku bunga dan yang membuat pegel hati klamaan menunggu saldonya ag banyak,Biaya/Potongan,negatif
82539727-24f5-47f1-b99e-cab7d20388e7,Wagely,1,,Lebih parah dr renternirrr.. makang bunga 200kali lipat. Gilakkkk,lebih parah dari renternirr.. makang suku bunga 200kali lipat. gilakk,Biaya/Potongan,negatif
c72b4499-ccb5-41f8-9284-a36373b7d0e0,Wagely,1,,"Sangat mengecewakan, biasanya juga klo dh bayar limit di atas 500 bisa di tarik, ini udah 900rb msh saja di non aktifkan akunnya, coba hubungi customer sama adminnya gk guna, gk ada titik terang. Payah..","sangat mengecewakan, biasanya juga kalau sudah membayar limit di atas 500 bisa di tarik, ini sudah 900rb masih saja di non aktifkan akunnya, mencoba menghubungi pelanggan sama adminnya tidak guna, tidak ada titik terang. payah..",Biaya/Potongan,negatif
aca5f1cf-065b-4ec1-9ca2-5eab9b498185,Wagely,1,,"Kalou bsa setiap transaksi 1 x potongan aja,lah ini malah di nonaktifkan Padahal potongan nya lancar kenapa di nonaktifkan payah ni,tapi ya sudah lah ga apa apa malah enak ga ada potongan lgi,50 itu besar bos.","kalou bisa setiap bertransaksi 1 kali pemotongan aja,lah ini malah di nonaktifkan padahal pemotongan ya lancar sekali mengapa di nonaktifkan buruk ni,tapi benar sudah lah tidak apa apa malah enak tidak ada pemotongan lgi,50 itu besar bos.",Biaya/Potongan,negatif
dfe2db62-e09b-4220-b3c7-1bc2207eccfa,Wagely,1,,"Biaya grtis hanya di awal, trus mahalllll pol adminnya mending pakai krtu kredit lebih murah","biaya grtis saja di awal, terus mahal pol adminnya mending memakai krtu kredit lebih murah",Biaya/Potongan,negatif
f4130dfc-2dea-425f-9104-b385c9c178e0,Wagely,1,,Biaya admin nya besar bgt sii,biaya administrator ya besar banget sih,Biaya/Potongan,negatif
f2e58564-f35b-4a06-83be-2e19d1d42bed,Wagely,1,,"Potongan admin mahal,dan terlalu mudah di pakai orng akunya,tanpa ada otp atau pengamanan lainya","pemotongan administrator mahal,dan amat sangat gampang di memakai orang akunya,tanpa ada otp atau pengamanan lainya",Biaya/Potongan,negatif
b621f418-07ad-48b0-8de8-d928fd5a2dd0,Wagely,1,,Ambilnya 1 x pas gajian dipotong 2 kali lipat 😭😭😭😭😭😭,ambilnya 1 kali pas penggajian dipotong 2 kali ini lipat,Biaya/Potongan,negatif
66510158-a9b0-4863-b611-57da328a35db,Wagely,1,,Semakin kesini biaya potongan semakin mahal.. semua nominal di kenakan biaya yg sama + PPN 11 % .. mencekik sekali,semakin ke sini biaya pemotongan semakin mahal.. semuanya jumlah nominal di kenakan biaya yang sama + ppn 11 % .. mencekik sekali,Biaya/Potongan,negatif
5981f68b-e4c2-4d10-9024-ddf88d7205e8,Wagely,1,,makin gak jelas biaya potongannya. terlalu banyak biaya tambahan,makin tidak jelas biaya potongannya. amat sangat banyak biaya tambahan,Biaya/Potongan,negatif
0dd85f1a-4cbc-4363-ad81-33248b401511,Wagely,1,,"Petugas nya ngomong ke aku lngsung kata nya ga ada bunga nya,tpi setiap bayar ada biaya admin,uang admin nya ga sesuai di apk pinjem nya 600rb yng di apk hrus bayar 654rb ko pas aku byar jadi 690rb yah! Tolong di perbaiki lgi dong yg jelas ga sesuai bgt pas mau byar nya","petugas ya berbicara ke aku langsung kata ya tidak ada suku bunga nya,tpi setiap membayar ada biaya admin,uang administrator ya tidak sesuai di aplikasi meminjam ya 600rb yang di aplikasi harus membayar 654rb kok pas aku membayar jadi 690rb yah! mohon di perbaiki lagi tolong yang jelas tidak sesuai banget pas mau membayar ya",Biaya/Potongan,negatif
99e7acab-a9e6-4e14-808a-310bd97ac4c3,Wagely,1,,hasil keringat sendiri kok ada potongan .toh bukan hutang .,hasil keringat sendiri mengapa ada pemotongan .toh bukan hutang .,Biaya/Potongan,negatif
2a64b622-0db9-49ce-bd2d-eab97a5a42d1,Wagely,1,,"Sangat tidak rekomendasi, bunga besar saldo kecil dan bertahap, rentenir berkedok aplikasi, sangat mencekik!!!","sangat tidak rekomendasi, suku bunga besar saldo kecil dan bertahap, rentenir berkedok aplikasi, sangat mencekik!!",Biaya/Potongan,negatif
02948232-d6d4-4df6-ae13-bc85b0c73d11,Wagely,1,,"Biaya admin terlalu tinggi, menyebabkan kerugian besar terhadap karyawan .","biaya administrator amat sangat tinggi, menyebabkan kerugian besar terhadap karyawan .",Biaya/Potongan,negatif
073c1df1-5e64-4542-b12f-a3c4e336adc2,Wagely,1,,"Katanya tidak ada bunga.. cuma pakai administrasi. Tapi potonganya gila""an melebihi bunga pinjaman di APK lain","katanya tidak ada bunga.. hanya memakai administrasi. tapi potonganya gila""an melebihi suku bunga meminjam di aplikasi lainnya",Biaya/Potongan,negatif
9134181d-dc7a-45b0-8d7c-d0abc3df44a1,Wagely,1,,"aplikasi jelek adminnya slow respon, ditanya pagi sampai pagi berikutnya di di jawab","aplikasi jelek adminnya lambat respon, ditanya subuh hingga subuh berikutnya di di menjawab",Biaya/Potongan,negatif
a13effe5-788f-46c7-9d63-a6b42b81f8b6,Wagely,1,,makin gak ngotak bunga nya melebihin rentenir,makin tidak ngotak suku bunga ya melebihi rentenir,Biaya/Potongan,negatif
584f09a2-7908-4202-9097-b4cdcc755f38,Wagely,1,,"penarikan hanya bisa 1x dlm 1bylan,sudah ada admin tp bunga sangat besar","penarikan saja bisa 1x dalam 1bylan,sudah ada administrator tapi suku bunga sangat besar",Biaya/Potongan,negatif
efcadece-dec4-49c3-b575-5a73e337d5a8,Wagely,1,,saya sangat kecewa dengan fitur wegly ini potongan buat bunga yha 50rb kali kan saja jika mengambil beberapa kali apa GK rugi kita kalo bunga potongan 10rb sih ok ok aja dan untuk fitur pengambilan 24jm kedepan saldo diproses itu lebih baik hilangkan deh ribet kita dibutuhin cepet ko malah ada fitur 24jm jadi bikin susah gak bisa bantu apa apa,saya sangat kecewa dengan fitur aplikasi wagely ini pemotongan untuk suku bunga ya 50rb kali ini kan saja jika mengambil beberapa kali ini apa tidak rugi kita kalau suku bunga pemotongan 10rb sih baik baik saja dan untuk fitur aplikasi pengambilan 24jm kedepan saldo diproses itu lebih baik hilangkan deh rumit kita dibutuhin cepat kok malah ada fitur aplikasi 24jm jadi membuat sulit tidak bisa membantu apa apa,Biaya/Potongan,negatif
3cbf0c74-0e22-4fce-a658-6c86f8f52fad,Wagely,1,,"aplikasi sering eror, potongan nya juga gede bangett.","aplikasi sering eror, pemotongan ya juga besar bangett.",Biaya/Potongan,negatif
91cb7250-23a5-43ad-b95f-50078da0c7b3,Wagely,1,,potongan semkin banyak dan lambat,pemotongan semkin banyak dan lambat,Biaya/Potongan,negatif
2ef265bd-37e9-4a85-97e7-805deddfda6c,Wagely,1,,"Kenapa update sekarang pakai pengiriman instan dengan potongan lebih. sedangkan ambil yang biasa harus nunggu. Mau ambil malah dipersulit, bagaimana kalau butuh mendesak. aplikasi kalau sudah merasa dibutuhkan selalu mencari keuntungan lebih. mohin diperhatikan kembali","mengapa update sekarang memakai pengiriman instan dengan pemotongan lebih. sedangkan ambil yang biasa harus nunggu. mau ambil malah dipersulit, bagaimana kalau membutuhkan mendesak. aplikasi kalau sudah merasa dibutuhkan selalu mencari keuntungan lebih. mohin diperhatikan kembali",Biaya/Potongan,negatif
2cb2325e-5b99-48ea-b9a7-dd77bfb2eaa3,Wagely,1,,di update mlh turun versi yg awalnya bisa narik lewat walet mlh jdi ga bisa yg awalnya bisa narik 750 ribu kapan aja walau limit masih kurang dari 750 ribu mlh jdi ga bisa stlh di updet mlh turun kmbali ke versi awal lucu banget aneh ga menarik fitur nya gitu gitu aja kurang bnget...cs nya juga slow respon di wa siang di bls jam 12 MLM 😅ga jauh beda sama pinjol ini MH cmn ini MH skligus di bayar jdi bgtu gjihan habis adminnya juga gede sama aja Kya bunga pinjol apa beda nya ga di awasi OJK juga,di update malah menurun versi yang awalnya bisa menarik lewat walet malah jadi tidak bisa yang awalnya bisa menarik 750 seribu kapan saja walau limit masih kurang dari 750 seribu malah jadi tidak bisa setelah di memperbarui malah menurun kembali ke versi mulai lucu banget aneh tidak menarik fitur aplikasi ya begitu begitu saja kurang bnget..cs ya juga lambat merespons di aplikasi whatsapp tengah hari di balas jam 12 malam tidak jauh berbeda sama pinjol ini mah hanya ini mah skligus di membayar jadi begitu gjihan habis adminnya juga besar sama saja kaya suku bunga pinjol apa berbeda ya tidak di awasi ojk juga,Biaya/Potongan,negatif
44de62e2-bd40-42c3-bea4-3bcd1bed3600,Wagely,1,,Adminnya slow respon banget ga gercep sama sekali,adminnya lambat merespons banget tidak cepat tanggap sama sekali,Biaya/Potongan,negatif
765f7e11-0bbb-494c-ba9e-a9358ed5bb10,Wagely,1,,gangerti sama sistem bayarnya bulan ini minjam cuman 200 ribu duakali tarik tapi pas gajian yg dipotong 800 ribulebih apa yg bula lalu?padahal tiap bulan kalo minjem gapernah gede tapi tiap bulan kena potongan yg gede,gangerti sama sistem bayarnya bulan ini meminjam hanya 200 seribu duakali tarik tapi pas penggajian yang dipotong 800 ribulebih apa yang bula lalu?padahal tiap bulan kalau meminjam tidak pernah besar tapi tiap bulan kena pemotongan yang besar,Biaya/Potongan,negatif
4f8219ea-9804-4e46-bbd8-03a258dd2476,Wagely,1,,tak kasih bintang 1 karna pelayanan y jelek bgt..sy komplen masalah transaksi tp CS y no respon..parah bgt asli.tolong perbaiki kinerja y jgn cuma gedein bunga y doang..,tak kasih bintang 1 karena pelayanan ya jelek bgt..sy komplen masalah bertransaksi tapi layanan pelanggan ya no respon..parah banget asli.tolong perbaiki kinerja ya jangan hanya gedein suku bunga ya doang..,Biaya/Potongan,negatif
a57e1e9c-f712-4976-b3fe-45062a2d5e0e,Wagely,1,,bunga berkedok biaya ke anggotaan. lebih mahal dari pinjol,suku bunga berkedok biaya ke anggotaan. lebih mahal dari pinjol,Biaya/Potongan,negatif
7d354d79-fbd9-4ca1-a9d1-688ef57d19f7,Wagely,1,,apk ga jls masa ga bisa minjem lagi admin gede potongan,aplikasi tidak jelas masa tidak bisa meminjam lagi administrator besar pemotongan,Biaya/Potongan,negatif
240fe154-90d7-4b1d-8134-94ea8d49a5c0,Wagely,1,,makin gede bunga nya dan proses penarikan kalo ketunda respon nya lama,makin besar suku bunga ya dan proses penarikan kalau ketunda merespons ya lama,Biaya/Potongan,negatif
c9b2bea3-5f3f-4236-8f61-f6738cf6c19d,Wagely,1,,"sering banget tiba² akun di nonaktifkan padahal masalah admin dan ppn yg nambah besar ga di terlalu di pikirkan tapi ini 2 minggu gak di aktifkan akun bayar mah tepat waktu ppn juga naik kita mah diem ini main gak aktif aja akun , udh wa cs malah di cuekin ...","sering banget tiba-tiba akun pengguna di nonaktifkan padahal masalah administrator dan ppn yang menambah besar tidak di amat sangat di pikirkan tapi ini 2 minggu tidak di aktifkan akun pengguna membayar saja tepat waktu ppn juga menaiki kita saja diam ini main tidak aktif saja akun pengguna , sudah aplikasi whatsapp layanan pelanggan malah di cuekin ..",Biaya/Potongan,negatif
b9ca96cc-c03c-4bd7-979f-9b5114cc4b06,Wagely,1,,"Kalo bisa di angsur jgn lgsung di potong full setelah gajian.. Kalo bisa admin di ringankan jgn terlalu tinggi.. Admin malah semakin tinggi dan per hari malah turun, bunga tambah gede.. kalo gk kepepet gk bakal ngambil wegley..","kalau bisa di angsur jangan langsung di memotong full setelah gajian.. kalau bisa administrator di ringankan jangan amat sangat tinggi.. administrator malah semakin tinggi dan per hari malah turun, suku bunga tambah gede.. kalau tidak kepepet tidak bakal mengambil wegley..",Biaya/Potongan,negatif
740d4762-9bfb-40dd-872c-9a1ef2b5d76e,Wagely,1,,Biaya keanggotaan membunuh,biaya keanggotaan membunuh,Biaya/Potongan,negatif
8f9fe06a-ef06-44e4-806c-8cede3c4653e,Wagely,1,,"woi aplikasi perampokan, katanya perbulan 20k doang, sampe selisih 150k-/+ sama temen gue gila berapa orang dah tu","woi aplikasi perampokan, katanya perbulan 20k doang, sampai selisih 150k-/+ sama teman saya gila berapa manusia sudah itu",Biaya/Potongan,negatif
95fbf67d-fa3a-4a5f-a128-408c4d79cab4,Wagely,1,,Bunga terlalku besar pelayanan buruk mendinb di unistal saja..,suku bunga terlalku besar pelayanan buruk mendinb di unistal saja..,Biaya/Potongan,negatif
f270f8c0-8b43-403e-a368-de7d9a5f0ae1,Wagely,1,,"wagely parah ditarik dari jam 00.27 sampe pagi gak masuk masuk, muter muter doang, Udah admin mahal ada biaya keanggotaan juga riweh , bener-bener bikin kecewaan!!!!","wagely parah ditarik dari jam 00.27 sampai subuh tidak masuk masuk, muter muter doang, sudah administrator mahal ada biaya keanggotaan juga riweh , benar-benar membuat kecewaan!!",Biaya/Potongan,negatif
a0a0e84b-d7a5-432c-b359-277b642e45ea,Wagely,1,,"hati hati dengan WAGELY, pinjam 560000, tagihan mu bisa 1600000... dan tiba2 kalian pinjem 1250000, tapi admin dan administrasi nya gak jelas gak ada di mana2.. ngeri WAGELY..","hati hati dengan wagely, meminjam 5600, penagihan mu bisa 1600.. dan tiba-tiba kamu semua meminjam 12500, tapi administrator dan administrasi ya tidak jelas tidak ada di mana2.. ngeri wagely..",Biaya/Potongan,negatif
12a67c6d-9977-4ecb-bb08-77ac5c392efd,Wagely,1,,"Semakin mahal bunga nya, mengecewakan!","semakin mahal suku bunga nya, mengecewakan!",Biaya/Potongan,negatif
54a3786c-5192-41bb-a613-acdff13ce8b1,Wagely,1,,biaya keanggotaan naek 100% biaya penarikan naek 175% makin gila nih apk. udh pengajuan hapus akun. tapi ga di APUS APUS. najis najis,biaya keanggotaan naik 100% biaya penarikan naik 175% makin gila ini apk. sudah pengajuan menghapus akun. tapi tidak di hapus apus. najis najis,Biaya/Potongan,negatif
f1601eaf-648f-41a2-8c50-d07897d83cb4,Wagely,1,,"kenapa fitur walet tiba tiba hilang padahal saya ambil terus taro disitu dulu malah ilang sia sia ambil tapi gak dirasain tetep dipotong,","mengapa fitur aplikasi walet tiba tiba hilang padahal saya ambil terus taro di situ dulu malah hilang sia sia ambil tapi tidak dirasain tetap dipotong,",Biaya/Potongan,negatif
149f5ed1-33e6-4402-bffc-70fe7baa6303,Wagely,1,,ngambil 25 ribu bunga dllin totalnya 13 000 ga logisss,mengambil 25 seribu suku bunga dllin totalnya 13 00 tidak logiss,Biaya/Potongan,negatif
c3c53f80-7d6b-4f5c-8934-9d82276378fd,Wagely,1,,pinjaman lebaran...cicilan 858.000.. kenapa jd 1.030.000 ga sesuai perjanjian...biaya keanggotaan 172000 maksudnya apa ini???...setiap pemotongan selalu berbeda dengan potongan member yg satu pekerjaan..ini aneh,meminjam lebaran..cicilan 858.00.. mengapa jadi 1.030.00 tidak sesuai perjanjian..biaya keanggotaan 17200 maksudnya apa ini??..setiap pemotongan selalu berbeda dengan pemotongan member yang satu pekerjaan..ini aneh,Biaya/Potongan,negatif
4953678c-df9c-4d28-abb7-edb32be678e5,Wagely,1,,apk korup adminnya,aplikasi korup adminnya,Biaya/Potongan,negatif
d0cf5c4d-4fde-4f17-8779-401e7a1101c3,Wagely,1,,"Apk aneh udah selesai potongan gaji besar di bulan maret, gaji april masih d potong. padahal cari duit susah","aplikasi aneh sudah selesai pemotongan gaji besar di bulan maret, gaji april masih di potong. padahal cari uang sulit",Biaya/Potongan,negatif
68535f88-5cd6-4e14-af92-f0415a5f17a5,Wagely,1,,"di komplen tidak ada jawaban , potongan gaji besar tidak sesuai dengan keterangan","di komplen tidak ada jawaban , pemotongan gaji besar tidak sesuai dengan keterangan",Biaya/Potongan,negatif
02b04f6b-45ca-45a1-99d3-b3af2c803814,Wagely,2,,"Hmm kata nya potongan nya 30.000 dan gak ada bunga, tau2 nya pas gajian potongan nya 80.000 an","hmm kata ya pemotongan ya 30.00 dan tidak ada bunga, tau-tau ya pas penggajian pemotongan ya 80.00 an",Biaya/Potongan,negatif
4b9d10bb-2e08-40f7-8f4c-ff0043552a85,Wagely,2,,"Ngeri biaya adminnya, padahal uang sendiri yg di ambil kenapa jasa sampai 30 RB ngeri bos","ngeri biaya adminnya, padahal uang sendiri yang di ambil mengapa jasa hingga 30 ribu ngeri bos",Biaya/Potongan,negatif
fc8fdb3d-1e0e-4503-a088-e83dd166f992,Wagely,2,,Payah semakin banyak yg pakai nih wagely biaya penarikan juga malah di naikin payah,buruk semakin banyak yang memakai ini wagely biaya penarikan juga malah di naikkan buruk,Biaya/Potongan,negatif
8b277e00-bded-4485-bec0-76775facde91,Wagely,2,,"Tolong dong buat PPN nya jgn gede² banget, masa 12% lebih mahal dibiaya keanggotaannya dari pada ngmbil duitnya, tolong dong turunin","mohon tolong untuk ppn ya jangan gede² banget, masa 12% lebih mahal dibiaya keanggotaannya dari kepada ngmbil duitnya, mohon tolong turunin",Biaya/Potongan,negatif
2e53d101-f97b-4faf-bf98-c2a4eac55b6f,Wagely,2,,knpa di updet ko mlh jdi turun versy nya udh bagus bisa lewat wallet trus udh bisa narik 750000 ribu kpan aja eh di updet mlh balik lgi ke semula mlh hilang smua nya kmbali ke awal konyol jdi kecewa.,kenapa di memperbarui kok malah jadi menurun versy ya sudah bagus bisa lewat wallet terus sudah bisa menarik 7500 seribu kapan saja eh di memperbarui malah balik lagi ke semula malah hilang semua ya kembali ke mulai konyol jadi kecewa.,Biaya/Potongan,negatif
7d960d72-2e63-4221-9454-79c8fb94b809,Wagely,3,,"Kenapa sekrang potongan nya selalu besar setiap penarikan ? Dulu pas awal² bisa 1x tarik 1 jt admin cuma 70 rbu , sekarang 3x tarik bisa total bayar plus admin bisa hampir 1 jt seratus rb lebih , memang membantu tpi knpa jd besar pot adimnya ?","mengapa sekarang pemotongan ya selalu besar setiap penarikan ? dulu pas awal² bisa 1x tarik 1 juta administrator hanya 70 ribu , sekarang 3 kali tarik bisa total membayar plus administrator bisa hampir 1 juta seratus ribu lebih , sungguh membantu tapi kenapa jadi besar pot adimnya ?",Biaya/Potongan,negatif
84c6649e-0689-4fe5-ad54-c4b035970060,Wagely,3,,"Kenapa potongan wagely terlalu besar yah,,hampir dua kali lipat dri total pengambilan,bulan kemarin ambil 400000 pas gajian kok di potong 750000 besar banget bunganya yah..melebihi rentenir gadungan,bahkan melebihi bunga pinjaman online,,sangat mencekik.","mengapa pemotongan wagely amat sangat besar yah,,hampir dua kali ini lipat dari total pengambilan,bulan kemarin ambil 400 pas penggajian mengapa di memotong 7500 besar banget bunganya yah..melebihi rentenir gadungan,bahkan melebihi suku bunga meminjam online,,sangat mencekik.",Biaya/Potongan,negatif
3f2995ff-26b8-4b25-842e-1508da3bdffa,Wagely,3,,"+ mau ambil berapapun bisa + cepat cair dalam hitungan detik - langsung dipotong otomatis pas gajian - pajak besar bgt (sekali ambil mau nominal gede atau kecil, pajak tetep gede) - bayar pake VA pun pajaknya gede bgt sampe 30rban beda sama apk keuangan yg lain yg kalo bayar pake VA pajaknya kecil paling cuma 2-3rb - PAJAK TERLALU BESAR MERUGIKAN - NIAT KEPEPET MALAH RUGI","+ mau ambil berapapun bisa + cepat cair di dalam hitungan seketika - segera dipotong otomatis pas penggajian - pajak besar banget (sekali ambil mau jumlah nominal besar atau kecil, pajak tetap gede) - membayar pakai va pun pajaknya besar banget sampai 30rban berbeda sama aplikasi keuangan yang lainnya yang kalau membayar pakai va pajaknya kecil paling sekali hanya 2-3rb - pajak amat sangat besar merugikan - niat kepepet malah rugi",Biaya/Potongan,negatif
180daa74-abe1-4f7a-be73-7ffc0491eb8a,Wagely,5,,"Keren,ga pake bunga lagi👍👍👍👍","keren,ga pakai suku bunga lagi",Biaya/Potongan,negatif
cf5b6507-ad56-4602-94ac-e552aa2cdc0e,Wagely,5,,Aplikasi yg sngt membantu para pegawai dasar disaat butuh dana dadakan.klo bisa diusahakan tanpa bunga akan lebih baik lagi atau tsk trllu mmberatkan anggota,aplikasi yang sangat membantu para pegawai dasar disaat membutuhkan dana dadakan.klo bisa diusahakan tanpa ada suku bunga akan lebih baik lagi atau tsk trllu mmberatkan anggota,Biaya/Potongan,negatif
2379dd5f-d653-4151-85a8-57771a89aebd,Wagely,5,,Trinakasih atas tanggapannya... Smoga tidak.lanjut wagely kepada perusahaan kami serius dan menindak siapa yg menambahkan biaya bunga 7%lebih di prusahaan Yo..in krna sudah memanpaatkan apk wagely untuk mencari keuntungan pribadi sehingga mencoreng citra wagely... Trimakasih..,trinakasih atas tanggapannya.. semoga tidak.lanjut wagely kepada perseroan kami serius dan menindak siapa yang menambahkan biaya suku bunga 7%lebih di perusahaan yo..in karena sudah memanpaatkan aplikasi wagely untuk mencari keuntungan pribadi sampai mencoreng citra wagely.. trimakasih..,Biaya/Potongan,negatif
56c8f59f-7788-4b34-94f4-d69369b88f15,Wagely,5,,"Bintang 5 nih untuk mu wagely,, cuma tolong untuk biaya potongan jangan gede begtu setiap penarikan,, memang membantu keuangan cuma biaya adminnya itu loh lumayan geude","bintang 5 ini untuk mu wagely,, hanya mohon untuk biaya pemotongan jangan besar begtu setiap penarikan,, sungguh membantu keuangan hanya biaya adminnya itu loh lumayan geude",Biaya/Potongan,negatif
5baf1296-d015-479a-8acc-c310a2db1c02,Wagely,5,,"aplikasi sangat membantu, tetapi BIAYA KEANGGOTAAN YA TERLALU BESAR","aplikasi sangat membantu, namun biaya keanggotaan benar amat sangat besar",Biaya/Potongan,negatif
e42d1e2b-f73c-4aa7-8b75-1da824895a33,Wagely,5,,Tambah gede biaya adminnya..hadeuhhh... Ada ppn juga yaelah.. Makin kesini makin kesana tambah mencekik..hadeuhhhh..kamvretttt,tambah besar biaya adminnya..hadeuhh.. ada ppn juga yaelah.. makin ke sini makin ke sana tambah mencekik..hadeuhh..kamvrett,Biaya/Potongan,negatif
64cbd3b1-44e5-4d7f-89aa-25ca2031fbfd,Wagely,5,,"apk ga guna , mending ga usah download, biaya keanggotaan terlalu besar, halah g ush download aj nih apk, duit gw hilang disini","aplikasi tidak manfaat , mending tidak usah download, biaya keanggotaan amat sangat besar, halah tidak usah mengunduh saja ini apk, uang saya hilang di sini",Biaya/Potongan,negatif
32c75633-ef60-43e7-a6d3-b0a6d180bf35,Wagely,5,,"bunga nya terlalu gede,bjirrr","suku bunga ya amat sangat gede,bjirr",Biaya/Potongan,negatif
b6202b8e-e176-44e7-9289-f12c4ad54188,Wagely,3,,Iya kalo bisa potongannya jgn langsung di potong .. di angsur 2x .,ya kalau bisa potongannya jangan segera di memotong .. di angsur 2 kali .,Biaya/Potongan,netral
f666c9dc-825e-4545-ba8a-0963b615c242,Wagely,3,,"gimana mau batalkan ikut arisan, gak ada orang nya tapi uang dipotong juga. sy WA gak direspon","bagaimana mau batalkan ikut arisan, tidak ada manusia ya tapi uang dipotong juga. saya aplikasi whatsapp tidak direspon",Biaya/Potongan,netral
edba3465-e733-4518-8d65-04b9470c3f66,Wagely,5,,potongannya flat tidak berubah setiap bulan ini yang saya suka tapi nominalnya menurut saya masih bisa dipertimbangkan lebih lanjut apakah sebanding dengan kecepatan dan kemudahan layanan yang diberikan,potongannya flat tidak berubah setiap bulan ini yang saya suka tapi nominalnya menurut saya masih bisa dipertimbangkan lebih lanjut apakah sebanding dengan kecepatan dan kemudahan layanan yang diberikan,Biaya/Potongan,netral
