review_id,app_name,rating,review_date,review_text_original,review_text_clean,aspect_category,sentiment
7a097554-08dc-4608-81dd-4a08c6ef4174,Mekari Flex,1,,"Iseng-iseng nyoba narik/pinjam 100rb. Potongan/biaya admin 40rb 😂. Terima hanya 60rb. Saldo pinjaman sudah ke potong. Tapi tidak masuk ke rekening udh 6 hari Kaga masuk masuk. Bagaimana dengan teman saya. Pinjam 500rb. Saldo sudah terpotong tapi Belum masuk ke rekening pribadi, udh 1 minggu lebih🤣. Harus nunggu persetujuan Admin/HRD kantor dulu. APLIKASI BOBROK..","iseng-iseng mencoba narik/pinjam 100rb. potongan/biaya administrator 40rb . terima saja 60rb. saldo meminjam sudah ke potong. tapi tidak masuk ke rekening sudah 6 hari kagak masuk masuk. bagaimana dengan teman saya. meminjam 500rb. saldo sudah terpotong tapi belum masuk ke rekening pribadi, sudah 1 minggu lebih . harus menunggu persetujuan admin/hrd pejabat dulu. aplikasi bobrok..",Kecepatan Pencairan,negatif
9cd523d3-6b76-45eb-af27-6460bb275c43,Mekari Flex,1,,"Aplikasi gajelas..udah berhasil tapi ga masuk"" saldo ke rekening","aplikasi gajelas..udah berhasil tapi tidak masuk"" saldo ke rekening",Kecepatan Pencairan,negatif
6cd05db2-9bef-4e16-913e-4fd4630c6916,Mekari Flex,1,,"Udh lebih dari seminggu penarikan limit belum di acc, mau di cancel ga bisa Meresahkan. . .!!!","sudah lebih dari seminggu penarikan limit belum di acc, mau di batalkan tidak bisa meresahkan. . .!!",Kecepatan Pencairan,negatif
de45cd37-9a5c-4f7b-91f4-4b620d69478e,Mekari Flex,1,,"Knpa pas pengajuan ke 2 tiba2 apk di blokir pdhl saya butuh buat tambahan sehari2 kerja,jadi ga jelas bgni","kenapa pas pengajuan ke 2 tiba-tiba aplikasi di blokir padahal saya membutuhkan untuk tambahan sehari2 kerja,jadi tidak jelas begini",Kecepatan Pencairan,negatif
e391d31b-2c71-414c-b5cf-6db86a810bd6,Mekari Flex,1,,Aneh Setiap pengajuan mesti Nunggu persetujuan Dari Pihak HRD.. lantas ini Gunanya aplikasi Buat apa Coba Pengajuan Beberapa hari belum di ACC Aplikasi Gak jelas aplikasi Para Mafia' bukannya Mengsejahterakan pekerja melah mengguntungkan Diri sendri' Aneh. Mana Potongan nya Gede Amat 20 Ribu setiap pengajuan' aplikasi Gak Guna.,aneh setiap pengajuan harus menunggu persetujuan dari pihak hrd.. lantas ini gunanya aplikasi untuk apa mencoba pengajuan beberapa hari belum di menyetujui aplikasi tidak jelas aplikasi para mafia' bukannya mengsejahterakan pekerja melah mengguntungkan diri sendri' aneh. mana pemotongan ya besar amat 20 seribu setiap pengajuan' aplikasi tidak guna.,Kecepatan Pencairan,negatif
84066ae5-0715-4603-a216-e60c68a8964e,Mekari Flex,1,,"Gak usah kirim notifikasi flex installment,kalo pengajuan udah ditolak.Padahal karyawan tetap,tapi gak bisa dapet benefitnya..Udah ada rencana,tapi jadi buyar semua.Kalo udah ditolak,gak usah kirim-kirim notif lagi.di PHP itu gak enak !!!","tidak usah mengirim notifikasi flex installment,kalo pengajuan sudah ditolak.padahal karyawan tetap,tapi tidak bisa dapat benefitnya..udah ada rencana,tapi jadi buyar semua.kalo sudah ditolak,gak usah kirim-kirim notifikasi lagi.di php itu tidak enak !!",Kecepatan Pencairan,negatif
5cce70a3-f12b-4df5-874d-383d6a7def7c,Mekari Flex,1,,"Saldo di mekari berkurang tapi tidak masuk-masuk, chatt suport gada respon selama 24jam. Saldonya nya pun gak di kembalikan gatau kemana","saldo di mekari berkurang tapi tidak masuk-masuk, chatt suport tidak ada merespons selama 24jam. saldonya ya pun tidak di kembalikan tidak tahu ke mana",Kecepatan Pencairan,negatif
7741ce65-9ab1-4d72-a9da-c7f8117c0277,Mekari Flex,1,,"aplikasinya kurang bagus padahal karyawan masih kerja, pingin pinjam lagi tapi ditolak gak jelas","aplikasinya kurang bagus padahal karyawan masih kerja, pengin meminjam lagi tapi tidak disetujui tidak jelas",Kecepatan Pencairan,negatif
a3cb4c5c-a76a-4b4c-8c2b-1a0932435bb1,Mekari Flex,1,,"Ga rekomen, lambat ga sesuai estimasi, parah busuk nya, udah nunggu lama tau tau di tolak hahahah lucu pantes rating ny busuk. Dari team mekari bilang ACC ga ACC ny tergantung HRD, sedangkan dari HRD perusahaan saya bekerja aja bilang itu kebijakan dari mekari. Lucu","tidak rekomen, lambat tidak sesuai estimasi, parah buruk nya, sudah menunggu lama tahu tahu di tolak hahahah lucu pantas rating nya busuk. dari team mekari mengatakan menyetujui tidak menyetujui nya tergantung hrd, sedangkan dari hrd perseroan saya bekerja saja mengatakan itu kebijakan dari mekari. lucu",Kecepatan Pencairan,negatif
d42b4b01-1270-4342-ab72-ad23332249d7,Mekari Flex,1,,Layanan pencairan lambat,layanan pencairan lambat,Kecepatan Pencairan,negatif
470442e2-7e11-4522-927c-151cab3f4845,Mekari Flex,1,,saya kecewa dengan aplikasi ini dikarenakan saat penarikan saldo atau gaji awal potongan saldonya sangat besar sekali senilai 30rb dan mekari flex sekarang menjadi sangat buruk,saya kecewa dengan aplikasi ini dikarenakan saat penarikan saldo atau gaji mulai pemotongan saldonya sangat besar sekali senilai 30rb dan mekari flex sekarang menjadi sangat buruk,Kecepatan Pencairan,negatif
a9672e58-88b2-41a8-85d0-b8093bb5b125,Mekari Flex,1,,Pncairaan trlalu lma . Dan tenor 20 harii,pncairaan terlalu lama . dan tenor 20 harii,Kecepatan Pencairan,negatif
4551b9c8-39fa-4b71-894a-d9fa544a73f9,Mekari Flex,1,,"Saya tarik saldo tapi ga masuk ke rekening saya ,, bangsattt apk ini","saya tarik saldo tapi tidak masuk ke rekening saya ,, bangsatt aplikasi ini",Kecepatan Pencairan,negatif
65e9b3db-6574-4f55-8169-294f15b20ebc,Mekari Flex,1,,Mekari sekarang biaya pencairanya terlalu besar,mekari sekarang biaya pencairanya amat sangat besar,Kecepatan Pencairan,negatif
94c7065b-c1b8-45fc-9762-378b5d7892e2,Mekari Flex,1,,Susahh nge ACC pencairan nya kalo lagi butuh kebanyakan harus Nunggu,susah menyetujui pencairannya kalau lagi membutuhkan kebanyakan harus menunggu,Kecepatan Pencairan,negatif
073ad684-9b6b-4fb7-8921-b01a23337947,Mekari Flex,1,,"Makin kesini makin ga jelas, Suruh upgrade vermuk lemot banget,camera jadi slow,kondisi terang tapi gagal mulu, Padahal data diri udah lengkap di carefast tapi masih aja pake vermuk, Setidaknya kalo belum siap untuk upgrade sistem jangan upgrade dulu!! Benerin dulu sistemnya!! kita kan narik gajih di awal sebagian bukan mau pinjol!!","makin ke sini makin tidak jelas, menyuruh tingkatkan vermuk lambat banget,camera jadi slow,kondisi terang tapi gagal mulu, padahal data diri sudah lengkap di carefast tapi masih saja pakai vermuk, setidaknya kalau belum siap untuk tingkatkan sistem jangan tingkatkan dulu!! memperbaiki dulu sistemnya!! kita kan menarik gaji di mulai separuh bukan mau pinjol!!",Kecepatan Pencairan,negatif
d8960200-aedd-4a1e-a939-c5cb005f8947,Mekari Flex,1,,"Potongan biaya penarikan saldo makin naik njir, dari 20k jadi 30k.. Verifikasinya makin ribet juga ngeRI BAnget..","pemotongan biaya penarikan saldo makin menaiki njir, dari 20k jadi 30k.. verifikasinya makin rumit juga ngeri banget..",Kecepatan Pencairan,negatif
0379488d-1857-40fb-bf2c-6de0ee25199f,Mekari Flex,1,,Cairin duit 300 rebu doang lama banget,cairin uang 300 rebu saja lama banget,Kecepatan Pencairan,negatif
b4070eea-11b9-437e-9f66-84776c73341a,Mekari Flex,1,,"Gak jelas APK nya, gak masuk2 konfirmasi OTP sms nya.","tidak jelas aplikasi nya, tidak masuk2 konfirmasi otp sms nya.",Kecepatan Pencairan,negatif
d33295b2-c53f-48ee-bb4f-d4667ef1c1ba,Mekari Flex,1,,"Aplikasi tidak berguna, setiap pengajuan harus isi form pengajuan pinjaman lagi, apa gunanya ada aplikasi ini","aplikasi tidak berguna, setiap pengajuan harus isi form pengajuan meminjam lagi, apa gunanya ada aplikasi ini",Kecepatan Pencairan,negatif
06ab0690-273c-45e2-8206-f4da356f5ce9,Mekari Flex,1,,Biaya pencairan 39.000 gak ngotak.manfaatin orang lagi susah.bentar lagi 50.000,biaya pencairan 39.00 tidak ngotak.manfaatin manusia lagi susah.bentar lagi 50.00,Kecepatan Pencairan,negatif
bfb11dda-f215-46f8-b361-c6c84072bcbe,Mekari Flex,1,,"Terlalu lama untuk pen cairan nya , sudah confirmasi ke admin nya malah ga da kabar ga jelas","amat sangat lama untuk pengin cairan ya , sudah confirmasi ke administrator ya malah tidak sudah kabar tidak jelas",Kecepatan Pencairan,negatif
6c10fdf4-a67e-4000-86e2-f6c5a50164d1,Mekari Flex,1,,Pengajuan lama banget udah di approve2 tapi step 2 lama,pengajuan lama banget sudah di approve2 tapi step 2 lama,Kecepatan Pencairan,negatif
3fe0ee38-7802-492e-8b9e-5bea63f85ca7,Mekari Flex,1,,"ini gimana nih mekari tolong lah respon , limit sudh di potong pendanaan blom masuk ke e-walet ?","ini bagaimana ini mekari mohon lah merespons , limit sudah di memotong pendanaan belum masuk ke e-walet ?",Kecepatan Pencairan,negatif
f26ae945-84dd-49f4-a440-f2d693c1437a,Mekari Flex,1,,"Halo CS Mekari Flex, Nama: Zendy Zelzian Saya ingin menanyakan tentang salddo udh terpotong.dana belum masuk sampai skrang..dari tanggal 29-05-2025..kaga ada respon..","halo layanan pelanggan mekari flex, nama: zendy zelzian saya ingin menanyakan tentang salddo sudah terpotong.dana belum masuk hingga skrang..dari tarikh 29-05-2025..kaga ada respon..",Kecepatan Pencairan,negatif
e9b945b6-8e59-4830-b735-9ea41ecbf759,Mekari Flex,1,,"mending hapus aja,bikin kecewa, yg biasanya bisa tarik gaji 2.950.000 eh sekarang turun jadi 1.500.000","mending menghapus aja,bikin kecewa, yang biasanya bisa tarik gaji 2.950.00 eh sekarang menurun jadi 1.500.00",Kecepatan Pencairan,negatif
7ac39bc9-23f3-4749-9008-47868dc08c89,Mekari Flex,1,,Dulu bisa sekali tarik semua saldo aktif. Sekarang harus 4x tarik. Jadi gede banget biayanya 20rb x 4 Update: biaya admin sekarang naik jadi 25rb. Saldo yg bisa dicairkan malah jadi berkurang sejuta doang. Parah parah. Makin mengecewakan ini apk,dulu bisa sekali tarik semuanya saldo aktif. sekarang harus 4 kali tarik. jadi besar banget biayanya 20rb kali 4 update: biaya administrator sekarang menaiki jadi 25rb. saldo yang bisa dicairkan malah jadi berkurang sejuta doang. parah parah. makin mengecewakan ini aplikasi,Kecepatan Pencairan,negatif
b186e2c3-0e47-4376-8961-242a61f3b00f,Mekari Flex,1,,kok saldo nya kosong ya padahal udah bayar 1 tgl,mengapa saldo nya kosong padahal sudah membayar 1 tanggal,Kecepatan Pencairan,negatif
2c320e12-9590-4387-bdaf-e667172d1ccf,Mekari Flex,1,,ga pernah di acc huh,tidak pernah di menyetujui huh,Kecepatan Pencairan,negatif
59090910-0db7-43fb-934d-6a4b59568cf9,Mekari Flex,1,,ga bisa tarik saldo kenapa ya..padahal saldo harian sudah ada,tidak bisa tarik saldo mengapa ya..padahal saldo per hari sudah ada,Kecepatan Pencairan,negatif
c350bf30-1e81-48a0-83c7-fc29d4b264e1,Mekari Flex,1,,"potongan admin nya terlalu besar pas tariksaldo.awalnya enak,lalu ketagihan karena butuh.nominal saldo nya gak berubah masih kecil pinjamannya.padahal potongannya sangat tdk masuk akal ketika top'up.adminnya gede....","pemotongan administrator ya amat sangat besar pas tariksaldo.awalnya enak,lalu ketagihan karena butuh.nominal saldo ya tidak berubah masih kecil pinjamannya.padahal potongannya sangat tidak masuk akal ketika top'up.adminnya gede..",Kecepatan Pencairan,negatif
c42adff7-486c-4f30-a243-002bfc2b6c49,Mekari Flex,1,,"saldo nya telat terus harus tgl 10 ini malah kosong,giliran bayar gesit..di perbaiki lah tolong..perusahaan tempat saya kerja sudah 5 thn jadi partner mekari","saldonya telat terus harus tanggal 10 ini malah kosong, giliran bayar gesit. diperbaiki lah tolong. perusahaan tempat saya kerja sudah 5 tahun jadi partner mekari",Kecepatan Pencairan,negatif
d6ab1e11-848b-4d5d-90cc-7e802a464995,Mekari Flex,1,,"terlalu lama proses peminjaman , dan tidak bisa di buat jadi uang darurat krna terlalu lama prosesnya dan tidak bisa fleksibel .!!!!","amat sangat lama proses peminjaman , dan tidak bisa di untuk jadi uang darurat karena amat sangat lama prosesnya dan tidak bisa fleksibel .!!",Kecepatan Pencairan,negatif
7b18a3bb-46e0-405f-bfa7-908f81f36358,Mekari Flex,1,,makin naik admin penarikan nya kayanya mau naik haji ya,makin menaiki administrator penarikan ya kayanya mau menaiki haji benar,Kecepatan Pencairan,negatif
2a523bbd-7b9e-4a7e-959c-271c735ecd8d,Mekari Flex,2,,Ko saldo belum masuk rekening juga transaksi sudah sukses saldo pun sudah terpakai,kok saldo belum masuk rekening juga bertransaksi sudah sukses saldo pun sudah terpakai,Kecepatan Pencairan,negatif
16c4aa55-f82f-4f0f-9833-5d423e02bd10,Mekari Flex,2,,Kasih 2 dulu...soalnya lama di acc harus melalui HRD nya dulu,kasih 2 dulu..soalnya lama di menyetujui harus melalui hrd ya dulu,Kecepatan Pencairan,negatif
830fd1e5-f73a-4ca3-a65b-335fbe2ae65d,Mekari Flex,2,,Udah 2 hari belum di acc penarikan ku itu,sudah 2 hari belum di menyetujui penarikan ku itu,Kecepatan Pencairan,negatif
90cf606b-cb99-454d-ab3d-fff3a5c476b4,Mekari Flex,2,,"min saya udh kirim ke Bank lain saldo berkurang tpi ke bank tidak masuk, gimana nih","min saya sudah mengirim ke bank lainnya saldo berkurang tapi ke bank tidak masuk, bagaimana ini",Kecepatan Pencairan,negatif
e8468884-c82a-484a-867d-de4763bf9c24,Mekari Flex,2,,"NGEBANTU SIH, TAPI TOLONG LAH MASA PENARIKAN ADMIN NYA LEBIH DARI 30RB. PADAHAL INI BUKAN PINJOL TAPI GAJI KITA SNDIRI.. ADMIN 10RB MASIH WAJAR LAH, LAH INI 30RBAN.. GILA AJA..","membantu sih, tapi mohon lah masa penarikan administrator ya lebih dari 30rb. padahal ini bukan pinjol tapi gaji kita sndiri.. administrator 10rb masih wajar lah, lah ini 30rban.. gila aja..",Kecepatan Pencairan,negatif
7b65bac2-e870-4925-9fe0-ffecf86365be,Mekari Flex,3,,"biasanya saldo nambah jam 2 pagi, ini kok udah jam 4 saldo belum nambah-nambah ya? padahal belum nyampe saldo maksimal. udah direfresh berkali kali tetep ga nambah juga. gimana ya?","biasanya saldo menambah jam 2 pagi, ini mengapa sudah jam 4 saldo belum nambah-nambah ya? padahal belum sampai saldo maksimal. sudah direfresh berkali kali ini tetap tidak menambah juga. bagaimana ya?",Kecepatan Pencairan,negatif
f51f04bc-bdca-4e07-844d-9c085395931f,Mekari Flex,3,,sekarang durasi narik saldo cma bsa tgl1-7 aja saldo dinonaktifkan mulu,sekarang durasi narik saldo cma bisa tgl 1-7 aja saldo dinonaktifkan mulu,Kecepatan Pencairan,negatif
7bc6dc42-1769-42d7-a260-547e22a4121f,Mekari Flex,3,,Saya sedikit kecewa pengajuan dari tgal 25 Desember sampai sekarang belum di daftar kan oleh pihak mekari entah dari agency JO,saya sedikit kecewa pengajuan dari tgal 25 desember hingga sekarang belum di mendaftar kan oleh pihak mekari entah dari agency jo,Kecepatan Pencairan,negatif
f71b2437-2dda-49d4-b053-88a84252928e,Mekari Flex,3,,"Ini kenapa gaji belum cair biasanya aja setengah 6 udah cair ini sampe jam 7 belum ada tanda"" cair","ini mengapa gaji belum cair biasanya saja setengah 6 sudah cair ini sampai jam 7 belum ada tanda"" cair",Kecepatan Pencairan,negatif
f0bc79b5-bad7-46f8-ada0-7d6b5d4abb36,Mekari Flex,3,,sering gagal tarik saldo...👎,sering gagal tarik saldo..,Kecepatan Pencairan,negatif
093133a4-c433-45b7-9b43-e1d89e14c4f8,Mekari Flex,3,,sudah pengajuan ko lama ya belum di setujui masih menunggu mulu,sudah pengajuan kok lama benar belum di setujui masih menunggu melulu,Kecepatan Pencairan,negatif
d2c1305b-e052-4e06-9d37-8ccceabe59a0,Mekari Flex,3,,"sekarang limitnya malah di turunin,udah potongannya 25.000 lg..",sekarang limitnya malah diturunkan sudah potongannya 25000 lagi,Kecepatan Pencairan,negatif
24da6d01-5897-41d3-b2c1-c12d2636edaf,Mekari Flex,3,,respon lama pengajuan proses lama,merespons lama pengajuan proses lama,Kecepatan Pencairan,negatif
6bf061d6-b60a-4cf6-9309-a4447105285e,Mekari Flex,4,,"Upprov nya lama, ini mau di Acc apa ga nya ga jelas","upprov ya lama, ini mau di menyetujui apa tidak ya tidak jelas",Kecepatan Pencairan,negatif
7af54fc1-9e87-4c88-9e16-4c601a2e28e4,Mekari Flex,4,,Kira kira berapa lama untuk pencairannya saya soalnya sedang diproses,kira kira berapa lama untuk pencairannya saya karena sedang diproses,Kecepatan Pencairan,negatif
7f599058-838b-4806-b8f2-8e8cd1f2af4b,Mekari Flex,4,,Cukup membantu disaat kekurangan dana dan emng sih agak kurang lambat untuk pencairannya dikarenakan harus menjadi koleganya terlebih dahulu,cukup membantu disaat kekurangan dana dan memang sih agak kurang lambat untuk pencairannya dikarenakan harus menjadi koleganya terlebih dahulu,Kecepatan Pencairan,negatif
8967e4b6-8414-4225-95f7-83d5c0624dd8,Mekari Flex,5,,"Cairnya lama banget kaya lagi di gantung, sebelum""nya cepet gak ada kendala ini udah hampir 5 hari belum cair juga gak kaya sebelum nya","mencairkan lama banget seperti lagi di gantung, sebelum""nya cepat tidak ada kendala ini sudah hampir 5 hari belum cair juga tidak seperti sebelum ya",Kecepatan Pencairan,negatif
31e92ab1-bac8-4f11-ba81-4281fb2385b6,Mekari Flex,5,,lama disetujui nya,lama disetujui ya,Kecepatan Pencairan,negatif
e2b01a5a-5085-4dce-aac2-3793aeb7c627,Mekari Flex,1,,saya baru saja mengajukan penarikan gaji,saya baru saja mengajukan penarikan gaji,Kecepatan Pencairan,netral
922ef88f-3839-427b-ba74-393ebd81e09a,Mekari Flex,3,,Kurang rekomend karna harus menunggu persetujuan dari hrd dlu jadi tidak bisa untuk kebutuhan yg benar² mendesak .. Dri tgl 10 pengajuan hingga hari ini belum ada kejelasan masih menunggu persetujuan terus 😒,kurang rekomendasi karena harus menunggu persetujuan dari hrd dulu jadi tidak bisa untuk kebutuhan yang benar² mendesak .. dari tanggal 10 pengajuan sampai hari ini belum ada kejelasan masih menunggu persetujuan terus,Kecepatan Pencairan,netral
37b7e9a4-b980-4611-a297-898b6c1fb1c9,Mekari Flex,3,,limit penarikan saya belum berubah bulan ini,limit penarikan saya belum berubah bulan ini,Kecepatan Pencairan,netral
d888731e-ce98-45d9-8e51-19f2576854fb,Mekari Flex,3,,"blm mencoba untuk mencairkn pinjaman, sblmnya pernah tpi blm tr acc oleh pihak PT kami.",belum mencoba untuk mencairkan pinjaman sebelumnya pernah tetapi belum di acc oleh pihak pt kami,Kecepatan Pencairan,netral
a32a162d-5f61-4025-97c6-92f6e4a2b4f5,Mekari Flex,4,,saya sudah mengajukan penarikan dana sejak kemarin dan sampai sekarang statusnya masih dalam proses belum ada konfirmasi lebih lanjut apakah berhasil atau tidak biasanya memang butuh waktu beberapa jam tapi kali ini agak lebih lama dari biasanya,saya sudah mengajukan penarikan dana sejak kemarin dan sampai sekarang statusnya masih dalam proses belum ada konfirmasi lebih lanjut apakah berhasil atau tidak biasanya memang butuh waktu beberapa jam tapi kali ini agak lebih lama dari biasanya,Kecepatan Pencairan,netral
b02cad6c-6629-4857-a003-d96547994663,Mekari Flex,5,,pengajuan penarikan saya masih diproses dan belum ada balasan dari cs,pengajuan penarikan saya masih diproses dan belum ada balasan dari cs,Kecepatan Pencairan,netral
f885e025-da41-463e-8d4c-38974cf7976b,Mekari Flex,5,,dana yang saya cairkan jumlahnya tidak besar tapi tetap butuh waktu sekitar empat jam untuk masuk ke rekening saya rasa wajar saja karena ini bukan transfer biasa ada proses verifikasi dari pihak perusahaan juga,dana yang saya cairkan jumlahnya tidak besar tapi tetap butuh waktu sekitar empat jam untuk masuk ke rekening saya rasa wajar saja karena ini bukan transfer biasa ada proses verifikasi dari pihak perusahaan juga,Kecepatan Pencairan,netral
ea6c8dfe-ae78-4dc3-9894-244f0ca5d4f8,Mekari Flex,5,,limitnya sudah aktif dan saya bisa mengajukan penarikan kapan saja tapi soal waktu cairnya ya tergantung kondisi sistem kadang cepat kadang agak lama tidak ada jaminan pasti berapa jam,limitnya sudah aktif dan saya bisa mengajukan penarikan kapan saja tapi soal waktu cairnya ya tergantung kondisi sistem kadang cepat kadang agak lama tidak ada jaminan pasti berapa jam,Kecepatan Pencairan,netral
bc471975-6e6e-4a3e-9a79-9841fc544c3b,Mekari Flex,5,,saya pernah mencairkan di hari yang sama dua kali pengajuan pertama cepat sekitar satu jam pengajuan kedua lebih lama hampir setengah hari mungkin ada antrian atau batasan sistem yang tidak saya ketahui,saya pernah mencairkan di hari yang sama dua kali pengajuan pertama cepat sekitar satu jam pengajuan kedua lebih lama hampir setengah hari mungkin ada antrian atau batasan sistem yang tidak saya ketahui,Kecepatan Pencairan,netral
e7df526c-31f0-4606-b686-cb89a6e5fefd,Mekari Flex,1,,"Apk ini kan buat kebutuhan mendesak...tapi jam tarik saldo ga flexibel, tarik saldo kebetulan bank offline, wajar ga langsung masuk. Tapi pas status bank yg bersangkutan sudah online, saldonya ga masuk masuk otomatis, malah sampe 2 hari ga masuk. Pas complain malah di refund ke aplikasi, itu pun slowww respon...tolonglah lebih ditingkatkan pelayanannya. Kebutuhan jelas mendesak malah jadi nungguin","aplikasi ini kan untuk kebutuhan mendesak..tapi jam tarik saldo tidak flexibel, tarik saldo kebetulan bank offline, wajar tidak segera masuk. tapi pas status bank yang bersangkutan sudah online, saldonya tidak masuk masuk otomatis, malah sampai 2 hari tidak masuk. pas keluhan malah di pengembalian dana ke aplikasi, itu pun sloww respon..tolonglah lebih ditingkatkan pelayanannya. kebutuhan jelas mendesak malah jadi menunggu",Kecepatan Pencairan,positif
88a0f338-1557-4b22-97b9-19cdda5b90f3,Mekari Flex,1,,"Saya karyawan di suatu perusahaan, sistimnya gantung satu bulan. jadi hasil kerja bulan ini, di bayarkan di akhir bulan berikutnya. Karna mendesak dan perlu uang. Pengajuan pinjaman 2juta. Di aplikasi ada administrasi 25.000,. Proses seminggu dan di hub. Ada tambahan potongan 8%. Langsung saya cancel. Yg sangat di sayangkan kenapa tidak di jelaskan di aplikasinya, harus di tlp ada tambahan lagi. Bukanya aplikasi dibuat untuk mempermudah, dan mempercepat sistim ya.?","saya karyawan di suatu perusahaan, sistimnya gantung satu bulan. jadi hasil kerja bulan ini, di bayarkan di terakhir bulan berikutnya. karena mendesak dan butuh uang. pengajuan meminjam 2juta. di aplikasi ada administrasi 25.00,. proses seminggu dan di hub. ada tambahan pemotongan 8%. segera saya cancel. yang sangat di sayangkan mengapa tidak di jelaskan di aplikasinya, harus di telepon ada tambahan lagi. bukanya aplikasi dibuat untuk mempermudah, dan mempercepat sistim ya.?",Kecepatan Pencairan,positif
fa1b1323-61da-4254-ba35-7f82d778d915,Mekari Flex,2,,GAK BERBOBOT MAU AMBIL GAJI DULUAN DISINI TAPI GAK OTOMATIS ..KURANG KERJA SAMA NYA SAMA PENGELOLAH APP.. MASA NUNGGU PAGI..OTOMATIS DONG ..PAS DI AMBIL LANGSUNG MASUK MASA NUNGGU DULU. ...,tidak berbobot mau ambil gaji duluan di sini tapi tidak otomatis ..kurang kerja sama ya sama pengelolah app.. masa menunggu pagi..otomatis tolong ..pas di ambil segera masuk masa menunggu dulu. ..,Kecepatan Pencairan,positif
cb1bee66-64fb-423c-bf78-10ada93caf3c,Mekari Flex,3,,"Lama proses persetujuan nya, harus kontak HRD kantor klo mao cepat, seharus nya yg begini di handel langsung sama apk nya. Sama ajh nyusahin orang yg lagi butuh ini mah","lama proses persetujuan nya, harus menghubungi hrd pejabat kalau mau cepat, seharus ya yang begini di handel segera sama aplikasi nya. sama saja menyusahkan manusia yang lagi membutuhkan ini saja",Kecepatan Pencairan,positif
1b984a11-9106-4542-bfe6-ba8f7a11e88b,Mekari Flex,3,,Bintang 3 dlu deh soalnya ga bisa buat kebutuhan mendesak .. Harus nunggu persetujuan HRD dlu yg gga tau kapan diacc nya parah .. gga langsung cair,bintang 3 dulu deh karena tidak bisa untuk kebutuhan mendesak .. harus menunggu persetujuan hrd dulu yang tidak tahu kapan diacc ya parah .. tidak segera cair,Kecepatan Pencairan,positif
f4c8d494-e15e-4ec5-a182-d5786e20664a,Mekari Flex,4,,Mekari sangat tepat dalam mengatasi solusi kebutuhan transaksi dan kendala penarikan,mekari sangat tepat dalam mengatasi solusi kebutuhan transaksi dan kendala penarikan,Kecepatan Pencairan,positif
a90dc12b-ec5b-46cd-952d-d397fe0927ca,Mekari Flex,4,,"Pilihan Voucher terlalu sedikit dan yg bagus mesti pakai accessible salary, tidak bisa flex benefit.","pilihan voucher amat sangat sedikit dan yang bagus harus memakai accessible salary, tidak bisa flex benefit.",Kecepatan Pencairan,positif
1442548d-0993-4a4d-82d1-53b8635f28d6,Mekari Flex,4,,Seharusnya penarikan bisa di tarik semua sesuai dgn limit,seharusnya penarikan bisa di tarik semuanya sesuai dengan limit,Kecepatan Pencairan,positif
7ffe3534-f209-4c90-acc9-4f35e0b64e77,Mekari Flex,4,,prosesnya cepat banget tidak sampai 5 menit sudah cair,prosesnya cepat banget tidak sampai 5 menit sudah cair,Kecepatan Pencairan,positif
54ccab26-78e7-4922-8e36-3c27240d5a8c,Mekari Flex,4,,solusi disaat lagi urgent dapat menarik gaji secepatnya makasih mekari flex,solusi disaat lagi urgent dapat menarik gaji secepatnya makasih mekari flex,Kecepatan Pencairan,positif
d1b238c0-95bb-4ec6-ad48-a97aa72a55ac,Mekari Flex,4,,"bagus responsif, tapi kenapa gaji saya tidak bisa di ambil di pengajuan cashbon nya ??","bagus responsif, tapi mengapa gaji saya tidak bisa di ambil di pengajuan cashbon ya ??",Kecepatan Pencairan,positif
502305cd-a2db-4246-a28e-89892d1096c0,Mekari Flex,4,,mudah dalam pengajuan,gampang di dalam pengajuan,Kecepatan Pencairan,positif
541f7937-95ec-4cbf-93ad-fd1231e96f40,Mekari Flex,5,,"Tercepat dikelasnya...besarin dong limitnya, misalnya 50% basic",tercepat dikelasnya besarin dong limitnya misalnya 50% basic,Kecepatan Pencairan,positif
48eafd88-67e5-4dec-8470-3ea374d9cd3f,Mekari Flex,5,,dana langsung masuk rekening dalam hitungan menit,dana langsung masuk rekening dalam hitungan menit,Kecepatan Pencairan,positif
3daf623d-bfa6-4dee-b743-92945db9ecca,Mekari Flex,5,,pencairan sangat cepat tidak perlu menunggu lama,pencairan sangat cepat tidak perlu menunggu lama,Kecepatan Pencairan,positif
da1563bd-1228-4f25-b92e-e81f22f33415,Mekari Flex,5,,Sangat membantu di beberapa bulan terakhir. Tp di Desember ini kenapa belum ada saldox padahal karyawan pengen cairkan krna ada kebutuhan. Tolong dibantu 🙏🙏,sangat membantu di beberapa bulan terakhir. tapi di desember ini mengapa belum ada saldox padahal karyawan ingin cairkan karena ada kebutuhan. mohon dibantu,Kecepatan Pencairan,positif
7ab95aa4-9f98-4054-ac22-640f856b3e48,Mekari Flex,5,,Alhamdulillah udh 2 kali di ACC terus ✌️😘,segala puji bagi allah sudah 2 kali ini di menyetujui terus,Kecepatan Pencairan,positif
