review_id,app_name,rating,review_date,review_text_original,review_text_clean,aspect_category,sentiment
3c0c032b-ed12-48f9-b9aa-88d5d497a147,VENTENY,3,,"Pertama kali saya mencoba aplikasi ini sudah bagus, banyak fitur yang ditampilkan, terutama keunikan fitu otomotif serta Edukasi, namun alangkah lebih bagus lagi jika ditambahkan fitur top-up untuk game mobile, PC, console, dan sejenisnya agar kita pengguna Venteny juga bisa lebih dipermudah dan lebih sering memakai aplikasi ini.","pertama kali kali ini saya mencoba aplikasi ini sudah bagus, banyak fitur aplikasi yang ditampilkan, terutama keunikan fitu otomotif serta edukasi, akan tetapi alangkah lebih bagus lagi jika ditambahkan fitur aplikasi isi ulang saldo untuk game mobile, pc, console, dan sejenisnya agar kita pengguna venteny juga bisa lebih dipermudah dan lebih sering memakai aplikasi ini.",Keandalan Sistem,negatif
42357501-fe3b-4d74-bf26-24308c562a44,VENTENY,3,,"Monmaaf ini jaringannya tolong diperbaiki yaa,saya mau beli token sama pulsa gak bs2","mohon maaf jaringannya tolong diperbaiki, saya mau beli token dan pulsa tidak bisa sama sekali",Keandalan Sistem,negatif
588c11de-d626-41a8-84e6-416b5cd20e6f,VENTENY,3,,Untuk pembuatan akun di bagian alamat gak bisa di ketik alamat tidak valid terus padahal sudah ✔,"untuk pembuatan akun di bagian alamat tidak bisa diketik, alamat tidak valid terus padahal sudah benar",Keandalan Sistem,negatif
45b95bda-63bd-495a-9f99-c701a20801d3,VENTENY,3,,Gak jelas banget udah di update pas di buka minta di update lagi. Di playstore nya aja uda ke update.. tapi setiap buka apknya minta di update terus..,"tidak jelas, sudah diperbarui tetapi saat dibuka meminta pembaruan lagi. di playstore sudah terbarui, tetapi setiap membuka aplikasinya selalu meminta pembaruan terus",Keandalan Sistem,negatif
595de804-37e6-429f-b5f4-35c9ff386f56,VENTENY,3,,Knp saat pembayaran diaplikasi ini GK bisa ya muter2 mulu,"mengapa saat pembayaran di aplikasi ini tidak bisa berjalan dengan benar, terus berputar loading",Keandalan Sistem,negatif
2bfa187d-4fcb-4b9e-b404-092e160b6a11,VENTENY,4,,Belum bisa maskin uang di saldo,belum bisa memasukkan uang ke saldo,Keandalan Sistem,negatif
a092cf45-24bf-4211-bc53-b6aa0dc06305,VENTENY,5,,"Mantap. Bisa nyimpan uang ku, jadi gak boros lagi. Bisa jadi pilihan dompet digital untuk kedepannya nih","mantap. bisa nyimpan uang ku, jadi tidak boros lagi. bisa jadi pilihan dompet digital untuk kedepannya ini",Keandalan Sistem,negatif
eac9fd4d-ee83-46bc-ac23-8f246d3ad85b,VENTENY,5,,Fitur konten edukasi online-nya cukup membantu di masa seperti ini. Semoga makin berkembang lebih lengkap lagi fitur ini.,fitur aplikasi konten edukasi online-nya cukup membantu di masa seperti ini. mudah-mudahan makin berkembang lebih lengkap lagi fitur aplikasi ini.,Keandalan Sistem,negatif
54b4f7d4-9ec4-4a0a-aa4b-db5b4a2588b9,VENTENY,5,,Apk nya bagus bangett aman lagi yakin nih gk mau download nnti nggk download nyesell lhoo apk aman terpercaya sukses selalu yaaa😍😍😍😍😍😍😍😍,aplikasi ya bagus banget baik lagi yakin ini tidak mau mengunduh nanti tidak mengunduh menyesal loh aplikasi baik terpercaya sukses selalu ya,Keandalan Sistem,negatif
1300c181-53a9-4599-b725-289fbd3a216a,VENTENY,5,,"Bagus sih aplikasinya , cuman ada beberapa bug yg muncul di device saya , seperti layar blank dan sering fc tapi jarang sih munculnya :( , tetap di update yahhh aplikasinya","bagus sih aplikasinya , hanya ada beberapa bug yang muncul di device saya , seperti layar tidak merespons dan sering fc tapi jarang sih munculnya :( , tetap di update ya aplikasinya",Keandalan Sistem,negatif
54c19231-8806-43d1-b5e5-dfa7a5ea93e6,VENTENY,5,,"Sepertinya ini aplikasi baru , soalnya baru tau ada aplikasi e wallet ini , baru coba dan hasilnya bagus gak kalah seperti e wallet sebelah , kalo bisa di tingkatkan lagi fiturnya :)","sepertinya ini aplikasi baru , karena baru tahu ada aplikasi e wallet ini , baru mencoba dan hasilnya bagus tidak kalah seperti e wallet sebelah , kalau bisa di tingkatkan lagi fiturnya :)",Keandalan Sistem,negatif
e56ce0dd-96ab-465a-b114-07325c976e32,VENTENY,5,,Aplikasinya bagus banget terus cocok buat orang yang mageran dan memudahkan membayar tagihan tanpa repot-repot lagi,aplikasinya bagus banget terus cocok untuk manusia yang malas gerak dan memudahkan membayar penagihan tanpa ada repot-repot lagi,Keandalan Sistem,negatif
2e55ca24-2855-40b2-ae4d-9ac6a4d86966,VENTENY,5,,"Aplikasinya bagus banget, mudah dipake ga lemot karna mbnya kecil jadi ga ngabisin memori hp","aplikasinya bagus banget, gampang dipakai tidak lambat karena mbnya kecil jadi tidak ngabisin memori handphone",Keandalan Sistem,negatif
8fb0cffe-7107-4918-a227-522499cb156b,VENTENY,5,,"Aplikasi lengkap Bisa top up, bisa bayar listrik, bisa bayar pulsa. Ada buat financial jg, ada fitur akademi jg. Jd ga repot kalau lg sibuk.","aplikasi lengkap bisa bagus up, bisa membayar listrik, bisa membayar pulsa. ada untuk financial jg, ada fitur aplikasi akademi jg. jadi tidak repot kalau lagi sibuk.",Keandalan Sistem,negatif
c1267007-3195-40fd-a5c0-eddf8465785b,VENTENY,5,,"Aplikasinya keren, enggak perlu bawa uang tunai lagi buat bayar di food merchant yang kita sukai dan ada penawaran promo menariknya juga jadi makin hemat pengeluaran kita","aplikasinya keren, tidak butuh bawa uang tunai lagi untuk membayar di food merchant yang kita sukai dan ada penawaran promo menariknya juga jadi makin hemat pengeluaran kita",Keandalan Sistem,negatif
5213b676-eae3-401a-9e6c-a44314b591b0,VENTENY,5,,Semenjak adaa aplikasi ini semua jdi mudah.mau bayar listrik .bli paket dasa atau isi pulsa jdi ga ribet lgi,semenjak ada aplikasi ini semuanya jadi mudah.mau membayar listrik .bli paket dasa atau isi pulsa jadi tidak rumit lagi,Keandalan Sistem,negatif
d5458147-0168-41ee-bab9-bbd85ab35467,VENTENY,5,,"Aplikasi yang bagus banget, fitur nya juga bagus apalagi yang suka jualan. Wajib banget punya aplikasi ini.","aplikasi yang bagus banget, fitur aplikasi ya juga bagus apalagi yang menyukai jualan. wajib banget punya aplikasi ini.",Keandalan Sistem,negatif
168005e0-fd10-4e77-a28c-3cc8fb45983d,VENTENY,5,,Baru dapat rekomendasi aplikasi venteny dari saudara katanya bagus dan ternyata benar-benar bagus dan canggih banget.... semua kebutuhan elektronik yang kita butuhkan bisa di aplikasikan di sini nggak perlu keluar² rumah lagi...,baru dapat rekomendasi aplikasi venteny dari saudara katanya bagus dan ternyata benar-benar bagus dan canggih banget.. semuanya kebutuhan elektronik yang kita butuhkan bisa di aplikasikan di di sini tidak butuh keluar² rumah lagi..,Keandalan Sistem,negatif
1d731d1a-55d6-4268-808a-b6b32d0d589a,VENTENY,5,,"Aplikasi ini sangat membantu untuk para karyawan. Fiturnya lengkap dan bervariasi. Apalagi di fitur V Academy, udah ada penawaran skills sharing online platform bagi karyawan, jadi makin memotivasi untuk meningkatkan skill dan ketrampilan kerja. Kalo butuh dana darurat pun, ada fitur V-nancial, jadi memang aplikasi ini bermanfaat banget.","aplikasi ini sangat membantu untuk para karyawan. fiturnya lengkap dan bervariasi. apalagi di fitur aplikasi v academy, sudah ada penawaran skills sharing online platform bagi karyawan, jadi makin memotivasi untuk meningkatkan skill dan ketrampilan kerja. kalau membutuhkan dana darurat pun, ada fitur aplikasi v-nancial, jadi sungguh aplikasi ini bermanfaat banget.",Keandalan Sistem,negatif
49f4ec13-cc13-44dd-bfa3-3e1cd8f6a593,VENTENY,5,,Aplikasi sangat membantu buat yang lagi mager kemana-mana. Aplikasinya lengkap dan mudah jadi ga usah ragu.,aplikasi sangat membantu untuk yang lagi malas gerak kemana-mana. aplikasinya lengkap dan gampang jadi tidak usah ragu.,Keandalan Sistem,negatif
a1c0dfa7-7865-4bcf-b856-968cbca6dd1b,VENTENY,5,,"Dapat rekomendasi dari saudara,ternyata aplikasinya bagus banget,memudahkan dalam bertransaksi digital saya,,sekarang akan saya rekomendasikan lagi untuk anda..mantul deh","dapat rekomendasi dari saudara,ternyata aplikasinya bagus banget,memudahkan di dalam bertransaksi digital saya,,sekarang akan saya rekomendasikan lagi untuk anda..mantul deh",Keandalan Sistem,negatif
1f3ab19a-b8aa-43b1-8797-8a74613fca6c,VENTENY,5,,Bagus nihh bisa beli kebutuhan disini tanpa keluar rumah apalagi masa ppkm. Bayar tagihan listrik jadi lebih mudah dengan aplikasi venteny,bagus nih bisa membeli kebutuhan di sini tanpa ada mengeluarkan rumah apalagi masa ppkm. membayar penagihan listrik jadi lebih gampang dengan aplikasi venteny,Keandalan Sistem,negatif
3890abe8-375c-405b-a4ff-6e6b50793968,VENTENY,5,,"Sebagai pengguna venteny, saya merasa banyak terbantu jika ingin membeli kebutuhan sehari-hari, apalagi banyak promo promo menarik. Selain beli kebutuhan, gampang juga jika ingin membayar tagihan listrik. Hanya tinggal buka app ini sudh bisa melakukan bnyk transaksi. Top deh.","sebagai pengguna venteny, saya merasa banyak terbantu jika ingin membeli kebutuhan sehari-hari, apalagi banyak promo promo menarik. selain membeli kebutuhan, mudah juga jika ingin membayar penagihan listrik. saja tinggal buka app ini sudah bisa melakukan banyak transaksi. bagus deh.",Keandalan Sistem,negatif
1c33056b-3e4a-4398-a654-5ff5345fe659,VENTENY,5,,Aplikasinya ringan fitur juga blumayan lengkap Proses transaksi juga lumayan cepat next time lebih ditingkatkan lgi ya aplikasinya,aplikasinya ringan fitur aplikasi juga blumayan lengkap proses bertransaksi juga lumayan cepat next time lebih ditingkatkan lagi benar aplikasinya,Keandalan Sistem,negatif
cb734417-2e23-4b8a-96e8-bd1a4b689966,VENTENY,5,,"Alhamdulillah ketemu venteny aplikasinya lumayan ngebantu penggunaannya juga gak ribet, next time diperbanyak lagi fiturnya yaa supaya lebih lengkap lagi. 👍","segala puji bagi allah ketemu venteny aplikasinya lumayan membantu penggunaannya juga tidak ribet, next time diperbanyak lagi fiturnya ya supaya lebih lengkap lagi.",Keandalan Sistem,negatif
0d7d3821-0cae-4557-9532-53339b4ccb10,VENTENY,5,,Aplikasinya sangat bagus Dan tentunya aku terbantu banget karena bisa bayar pdam sama bpjs dari rumah tanpa keluar ongkos transport dong. Apalagi ada promo-promo menarik lainnya.,aplikasinya sangat bagus dan tentunya aku terbantu banget karena bisa membayar pdam sama bpjs dari rumah tanpa ada mengeluarkan biaya transport dong. apalagi ada promo-promo menarik lainnya.,Keandalan Sistem,negatif
0cf4ebc7-c4f7-4894-9d98-1e664bb62c48,VENTENY,5,,Aplikasinya bagus fitur juga lumayan lengkap dan pendaftaran nya juga cepat good kedepannya ditingkatkan lagi yaaa👍,aplikasinya bagus fitur aplikasi juga lumayan lengkap dan pendaftaran ya juga cepat bagus kedepannya ditingkatkan lagi ya,Keandalan Sistem,negatif
c2c20f44-d6c0-43f5-b707-892666022682,VENTENY,5,,"Terbantu dengan ada nya aplikasi venteny, pulsa listrik abis tinggal top up dari venteny tanpa harus keluar rumah. Apalagi dimasa pandemi ini kita harus meminimalisir kontak dengan dunia luar, dan dengan venteny sangat membantu dalam segala pembayaran dari rumah. Terimakasih venteny 👍","terbantu dengan ada ya aplikasi venteny, pulsa listrik habis tinggal bagus memperbarui dari venteny tanpa ada harus mengeluarkan rumah. apalagi dimasa pandemi ini kita harus meminimalisir menghubungi dengan dunia luar, dan dengan venteny sangat membantu di dalam segala pembayaran dari rumah. terima kasih venteny",Keandalan Sistem,negatif
f3a8ada2-9195-46f7-afe1-5ce82bb8c62b,VENTENY,5,,"dompet digital yg aman dan bisa dibawa kemana mana, kalo lg urgent bisa bgt lngsng topup ewallet disini, recommended banget pokonyaa","dompet digital yang baik dan bisa dibawa ke mana mana, kalau lagi urgent bisa banget langsung isi ulang saldo dompet digital disini, direkomendasikan banget pokonyaa",Keandalan Sistem,negatif
4ddeee9a-5848-4f92-93b6-b129349115bb,VENTENY,5,,"Ini aplikasi menunya banyak banget dan sangat memudahkan transaksi ku. Bisa top up ewallet ku, bayar wifi langganan, tagihan listrik dan masih banyak lagi. Top deh","ini aplikasi menunya banyak banget dan sangat memudahkan bertransaksi ku. bisa bagus memperbarui dompet digital ku, membayar wifi langganan, penagihan listrik dan masih banyak lagi. bagus deh",Keandalan Sistem,negatif
4da55293-3cac-4d0e-bfb2-caa0c9d9612e,VENTENY,5,,"Puas banget sama pelayanan aplikasinya, apalagi saya sibuk dengan aplikasi ini bisa memudahkan saya untuk membayar listrik contohnya dan berbelanja lain nya🥰","puas banget sama pelayanan aplikasinya, apalagi saya sibuk dengan aplikasi ini bisa memudahkan saya untuk membayar listrik contohnya dan berbelanja lainnya ya",Keandalan Sistem,negatif
ca76e2ca-a731-46e4-ac59-af03a5026453,VENTENY,5,,Aplikasi ini emang yang terbaik dari yang terbaik... Semua pengeluaran dan pemasukan keuangan kita bisa di atur hanya di aplikasi ini... Bisa juga membeli kebutuhan elektronik yang kalian tidak usah keluar rumah lagi cuma aplikasi ini saja.,aplikasi ini memang yang paling baik dari yang terbaik.. semuanya pengeluaran dan pemasukan keuangan kita bisa di atur saja di aplikasi ini.. bisa juga membeli kebutuhan elektronik yang kamu semua tidak usah mengeluarkan rumah lagi hanya aplikasi ini saja.,Keandalan Sistem,negatif
2d640155-d8f5-4874-ba3d-af55dcc9b288,VENTENY,5,,Venteny oh venteny aplikasinya simple banget pendaftaran gak ribet gak tau mau ngetik apalagi. Pokoknya bagus deh hihihiii👍,venteny oh venteny aplikasinya simple banget pendaftaran tidak rumit tidak tahu mau mengetik apalagi. pokoknya bagus deh hihihii,Keandalan Sistem,negatif
84e5213b-0573-42ba-9fc3-9b9206bf034c,VENTENY,5,,"Lumayan lah aplikasinya saya jadi gak perlu keluar rumah buat beli pulsa dan bayar tagihan listrik, tinggal buka venteny beres deh. Kedepannya semoga lebih baik lg","lumayan lah aplikasinya saya jadi tidak butuh mengeluarkan rumah untuk membeli pulsa dan membayar penagihan listrik, tinggal buka venteny beres deh. kedepannya mudah-mudahan lebih baik lagi",Keandalan Sistem,negatif
1da6da47-6fec-458a-81a9-3b9083637613,VENTENY,5,,"Aplikasi sangat Berguna dan membantu sekali,Apalagi kalau lagi butuh Pulsa, bisa Langsung aja top up di Aplikasi Venteny, tanpa harus pergi ke counter","aplikasi sangat bermanfaat dan membantu sekali,apalagi kalau lagi membutuhkan pulsa, bisa segera saja bagus memperbarui di aplikasi venteny, tanpa ada harus berangkat ke counter",Keandalan Sistem,negatif
96ffab28-0f69-4a87-8b6b-9903a7f43782,VENTENY,5,,"Venteny benar benar bisa dijadikan sebagai platform untuk kita yang mau jadi agen voucher, ditambah lagi fitur dan tampilanya simple dan menarik jadi sangat mempermudah","venteny benar benar bisa dijadikan sebagai platform untuk kita yang mau jadi agen voucher, ditambah lagi fitur aplikasi dan tampilanya simple dan menarik jadi sangat mempermudah",Keandalan Sistem,negatif
e1743a68-10ba-4fc7-a1d5-5f794f1a67d6,VENTENY,5,,Aplikasinya sangat keren. Saat token listrik habis ga usah jauh2 lagi pergi k minimarket tinggal klik lngsng terisi.,aplikasinya sangat keren. saat token listrik habis tidak usah jauh2 lagi berangkat kak minimarket tinggal klik langsung terisi.,Keandalan Sistem,negatif
5b8aebc3-64ea-40c7-a413-ea4fb30e30b8,VENTENY,5,,Membantu banget aplikasi ini. Fiturnya banyak. Gak pake lemot. Good pokoknya. Makasih venteny.,membantu banget aplikasi ini. fiturnya banyak. tidak pakai lemot. bagus pokoknya. terima kasih venteny.,Keandalan Sistem,negatif
9ef70929-829f-4aba-a705-6c4e8831b13a,VENTENY,5,,"Aplikasi ini sangan recomended bngt ,di aplikasi ini kita bisa beli keperluan sehari hari ,bisa juga buat transaksi apa' aja seperti pulsa listrik dan masih banyak lagi , banyak promo juga disini ,sangat beruba banget","aplikasi ini sangat direkomendasikan banget ,di aplikasi ini kita bisa membeli keperluan sehari hari ,bisa juga untuk bertransaksi apa' saja seperti pulsa listrik dan masih banyak lagi , banyak promo juga di sini ,sangat beruba banget",Keandalan Sistem,negatif
a60420dc-1112-4b64-a36c-99155cff05ff,VENTENY,5,,"Awalnya direkomendasikan sama temen untuk pake app ini, buat bayar BPJS daripada harus capek keluar ongkos ke kota. Candu sampe sekarang, apalagi banyak promo-promo menarik dalam app ini.","awalnya direkomendasikan sama teman untuk pakai app ini, untuk membayar bpjs daripada harus capek mengeluarkan biaya ke kota. candu sampai sekarang, apalagi banyak promo-promo menarik di dalam app ini.",Keandalan Sistem,negatif
4b2bc0aa-a1c6-4d13-b9f9-97647d50b057,VENTENY,5,,"Venteny memang the best. Fiturnya banyak dan tentunya bermanfaat dan membantu banget. Dengan adanya app ini aku ga harus lagi capek-capek keluar rumah buat beli paketan. Cukup dari rumah aja, apalagi harganya lebih mumer","venteny sungguh the best. fiturnya banyak dan tentunya bermanfaat dan membantu banget. dengan adanya app ini aku tidak harus lagi capek-capek mengeluarkan rumah untuk membeli paketan. cukup dari rumah aja, apalagi harganya lebih mumer",Keandalan Sistem,negatif
b6695c40-842d-49b0-a313-a76603bbca02,VENTENY,5,,Tak perlu repot2 keluar rmh lg klo mw beli token listrik tinggal pakai aplikasi Venteny aj smw bisa dilakukan dr rmh. Kereen 👍,tak butuh repot-repot mengeluarkan rumah lagi kalau mau membeli token listrik tinggal memakai aplikasi venteny saja semua bisa dilakukan dari rmh. keren,Keandalan Sistem,negatif
42522ef8-acc0-465a-b141-ac83a27dce68,VENTENY,5,,"Rekomend banget nih apk buat kaum rebahan seperti saya, karena apk ini mempermudah untuk kebutuhan elektronik dan sebagai nya. Contoh nya untuk beli pulsa/ kuota, token listrik, dll ga perlu keluar rumah cukup menggunakan apk ini aja untuk membeli yg di butuhkan. Jadi tunggu apa lagi yg belum download ayo download skrng karena apk nya nya tidak mengecewakan👌👌","rekomendasi banget ini aplikasi untuk kaum rebahan seperti saya, karena aplikasi ini mempermudah untuk kebutuhan elektronik dan sebagai nya. contoh ya untuk membeli pulsa/ kuota, token listrik, dll tidak butuh mengeluarkan rumah cukup menggunakan aplikasi ini saja untuk membeli yang di butuhkan. jadi tunggu apa lagi yang belum mengunduh ayo mengunduh sekarang karena aplikasi ya ya tidak mengecewakan",Keandalan Sistem,negatif
b68e3bcd-cf4f-463d-976f-2670e555e7c4,VENTENY,5,,"Apk ini recomended banget buat anak- jaman sekarang yg segala kebutuhanya berbau elektronik canggih, gaperlu pusing kalo mau mesen sesuatu apalagi kalo disuruh ibu beli token listrik jadi langsung ke apk venteny aja. Fitur- nya juga bnyk banget dan pastinya sangat bermanfaat so gaperlu ragu buat yg mau download ayo gausa mikir lama- cuss buruan download biar ga nyesell","aplikasi ini direkomendasikan banget untuk anak- jaman sekarang yang segala kebutuhanya berbau elektronik canggih, tidak perlu pusing kalau mau mesen sesuatu apalagi kalau disuruh emak membeli token listrik jadi segera ke aplikasi venteny aja. fitur- ya juga banyak banget dan pastinya sangat bermanfaat sok tidak perlu ragu untuk yang mau mengunduh ayo tidak usah mikir lama- cuss buruan mengunduh biar tidak menyesal",Keandalan Sistem,negatif
0412960c-81eb-49bc-a5ae-9c4bd4af2088,VENTENY,5,,"Excited banget guys gue kali ini. Venteny emang bagus banget, diskonya super super menggelegar. Apalagi ada voucher di v-merchant favorit gue. Nambah favv sih sama venteny.","excited banget guys saya kali ini ini. venteny memang bagus banget, diskonya super super menggelegar. apalagi ada voucher di v-merchant favorit gue. menambah favv sih sama venteny.",Keandalan Sistem,negatif
17cdc623-3bde-4569-acd3-a9e8d9e6e9b6,VENTENY,5,,"Fiturnya lengkap untuk kebutuhan sehari², apalagi untuk kaum rebahan yang mager 😆 aplikasi ini sangat membantu..","fiturnya lengkap untuk kebutuhan sehari², apalagi untuk kaum rebahan yang malas gerak aplikasi ini sangat membantu..",Keandalan Sistem,negatif
74adff31-b4a8-4427-9dd3-c589d24171c8,VENTENY,5,,"Beli pulsa jadi mudah dengan adanya venteny, gak perlu keluar rumah lagi. Mendukung banget pas lg ada pandemi","membeli pulsa jadi gampang dengan adanya venteny, tidak butuh mengeluarkan rumah lagi. mendukung banget pas lagi ada pandemi",Keandalan Sistem,negatif
bbd6762e-8380-4d60-a208-8e9dec883385,VENTENY,5,,"Sekarang beli kuota nggak harus lagi jalan kaki ke konter, apalagi letaknya lumayan jauh. Cukup lewat app ini, aku bisa beli kuota ditambah ada banyak diskonnya. Makin mantap deh","sekarang membeli kuota tidak harus lagi jalan kaki ke konter, apalagi letaknya lumayan jauh. cukup lewat app ini, aku bisa membeli kuota ditambah ada banyak diskonnya. makin mantap deh",Keandalan Sistem,negatif
211dbbc2-9d8c-4c05-9e31-c26ecf2f9705,VENTENY,5,,Kaum muda jaman sekarang kayaknya cocok download aplikasi ini. Apalagi aplikasi ini gampanggg banget digunain buat bayar kebutuhan sehari hari. Dijamin gabakal rugi,kaum muda jaman sekarang kayaknya cocok mengunduh aplikasi ini. apalagi aplikasi ini gampangg banget digunain untuk membayar kebutuhan sehari hari. dijamin tidak bakal rugi,Keandalan Sistem,negatif
25a349c2-a8fb-49e8-bab3-22249d33b37a,VENTENY,5,,"Aplikasi yg simpel. Dengan satu aplikasi, banyak yg bisa dilakukan. Apalagi suka ada promo buat penggunanya, yg menjadikan app ini favorit saya. Jadi membeli buat kebutuhan keseharian gampng dan murah.","aplikasi yang simpel. dengan satu aplikasi, banyak yang bisa dilakukan. apalagi menyukai ada promo untuk penggunanya, yang menjadikan app ini favorit saya. jadi membeli untuk kebutuhan keseharian gampng dan murah.",Keandalan Sistem,negatif
e6152f62-18c6-45cb-bac4-dde4e183ec3b,VENTENY,5,,"Bayar listrik, isi kuota, semua bisa di Venteny. Bebas biaya adminnya juga lagi. Terbantu banget nih di rumah karna venteny","membayar listrik, isi kuota, semuanya bisa di venteny. bebas biaya adminnya juga lagi. terbantu banget ini di rumah karena venteny",Keandalan Sistem,negatif
62782d75-dee1-43c7-8715-f5044ec9d77e,VENTENY,5,,"Pake venteny emang ok banget. Mantab bisa buat semua kebutuhan dalam satu aplikasi, mau top up game pun bisa apalagi beli kuota. Emang recomended banget","pakai venteny memang baik banget. bagus bisa untuk semuanya kebutuhan di dalam satu aplikasi, mau bagus memperbarui game pun bisa apalagi membeli kuota. memang direkomendasikan banget",Keandalan Sistem,negatif
a5e6d1db-f74f-4196-accb-062d1a2909b8,VENTENY,5,,"Lengkap banget merchant di venteny, bisa bayar bayar pakai 1 aplikasi doang. Ada video edukasinya lagi buat belajar skills bisa banget, cukup lengkap sistem pembayarannya bisa reservasi hotel keren","lengkap banget merchant di venteny, bisa membayar membayar memakai 1 aplikasi doang. ada video edukasinya lagi untuk belajar skills bisa banget, cukup lengkap sistem pembayarannya bisa reservasi hotel keren",Keandalan Sistem,negatif
6d1e98fe-80a3-41be-ae7d-226b46a26165,VENTENY,5,,Aplikasi yang keren sekali. Cocok buat ibu ibu yang lagi mager. Bisa bayar tagihan listrik dari rumah dan gak ribet.,aplikasi yang keren sekali. cocok untuk emak emak yang lagi mager. bisa membayar penagihan listrik dari rumah dan tidak ribet.,Keandalan Sistem,negatif
d31121b3-01ef-414d-b640-156e9fe92d01,VENTENY,5,,Very helpfull aplikasinya jadi bisa beli token pln lewat apk ini gk perlu keluar rumah lagi dan pembayarannya juga mudah selain itu banyak menu2 lainnya yg gk kalah bagus juga,very helpfull aplikasinya jadi bisa membeli token pln lewat aplikasi ini tidak butuh mengeluarkan rumah lagi dan pembayarannya juga gampang selain itu banyak menu2 lainnya yang tidak kalah bagus juga,Keandalan Sistem,negatif
ce24c6e5-f4ca-4bcb-bbac-8ac2f2416411,VENTENY,5,,Sangat membantu banget buat ibu2 yg suka kelupaan beli token pln dan mls beli kouta ke konter cuma pake apk ini aja gk ribet2 lagi,sangat membantu banget untuk ibu-ibu yang menyukai kelupaan membeli token pln dan malas membeli kuota ke konter hanya pakai aplikasi ini saja tidak ribet2 lagi,Keandalan Sistem,negatif
54c5f7d2-4e7e-4662-ac8d-a6b05e52d588,VENTENY,5,,"Aplikasi ini bagus banget, mempermudah kita semua dalam setiap transaksi. Apalagi untuk orang yang super sibuk ga bakal nyesel deh pake aplikasi ini, mau bayar apapun ga perlu ribet lagi.","aplikasi ini bagus banget, mempermudah kita semuanya di dalam setiap transaksi. apalagi untuk manusia yang super sibuk tidak bakal menyesal deh pakai aplikasi ini, mau membayar apapun tidak butuh rumit lagi.",Keandalan Sistem,negatif
0152a182-fe1a-4216-85d2-b37215aacc97,VENTENY,5,,"Venteny membantu banget, ngga perlu ribet lagi bayar tagihan rumah tangga.. aplikasinya juga simpel 👍","venteny membantu banget, tidak butuh rumit lagi membayar penagihan rumah tangga.. aplikasinya juga sederhana",Keandalan Sistem,negatif
bb34996e-d4c8-48d2-a0a2-7082ec59ce6a,VENTENY,5,,"Seneng banget bisa nemu aplikasi ini superr lengkap gaperlu ribet lagi mau transfer atau isi pulsa harus keluar rumah, sekarang tinggal pke venteny. Disini juga disediakan jasa asuransi dan jual beli motor ternyata kereen banget dehh pokonya mantappss aplikasi ini wajib banget ada di hp kalian yg gamau ribet keluar2👍","senang banget bisa nemu aplikasi ini superr lengkap tidak perlu rumit lagi mau transfer atau isi pulsa harus mengeluarkan rumah, sekarang tinggal pakai venteny. di sini juga disediakan jasa asuransi dan menjual membeli motor ternyata keren banget deh pokoknya mantappss aplikasi ini wajib banget ada di handphone kamu semua yang tidak mau rumit keluar2",Keandalan Sistem,negatif
02de94cd-9b23-47a2-9dd3-f2e2b9d00d30,VENTENY,5,,"Aku cukup terbantu dengan adanya aplikasi VENTENY ini , apalagi di era pandemi seperti sekarang ini, memang aplikasi ini mempermudah jalanku melakukan kegiatan jual beli online tanpa harus ribet, sepain itu di aplikasi ini pun bisa menambah skil akademi . Semangat maju aplikasi VENTENY.","aku cukup terbantu dengan adanya aplikasi venteny ini , apalagi di era pandemi seperti sekarang ini, sungguh aplikasi ini mempermudah jalanku melakukan kegiatan menjual membeli online tanpa ada harus ribet, sepain itu di aplikasi ini pun bisa menambah skil akademi . semangat maju aplikasi venteny.",Keandalan Sistem,negatif
