app_name,package_name,review_id,user_name,review_text,rating,review_date
VENTENY,app.fortuna.venteny,eec99415-960a-438e-bbb7-e814783a6abc,Iskandar Aja,"Aplikasi yang cocok untuk anda yang berencana menjadi agen voucher,karena sistemnya yang memudahkan dan tidak ribet",5,2021-12-17
VENTENY,app.fortuna.venteny,84e5213b-0573-42ba-9fc3-9b9206bf034c,Chusnul Chatimah,"Lumayan lah aplikasinya saya jadi gak perlu keluar rumah buat beli pulsa dan bayar tagihan listrik, tinggal buka venteny beres deh. Kedepannya semoga lebih baik lg",5,2021-12-17
VENTENY,app.fortuna.venteny,fdcaf82c-8bc9-4f21-9c7e-ca2c65b18622,Alus Pisan,"Aplikasi sangat bagus sekali, sangat membantu sekali,, pokonya aplikasi ini the best",5,2021-12-17
VENTENY,app.fortuna.venteny,4cf92fc1-ea1d-400e-8d2c-a457801fb39e,Budi Santoso,"Kalo keabisan paket internet jadi praktis sekarang,cukup download venteny terus bayar bayar jadi gampang deh",5,2021-12-17
VENTENY,app.fortuna.venteny,cd474180-dc4a-48a8-9cca-5bc01d300e1e,YULIA Wulandari,Assalamu'alaikum cuma mau kasih tau apk nya sangat bagus ayo segera dowload sekarang!!! 😇,5,2021-12-17
VENTENY,app.fortuna.venteny,541ce183-20df-42c4-a486-b5a828994c06,Silvio Juliana Nabela,Aplikasi yg memudahkan penggunanya. Bisa beli pulsa lebih mudah,5,2021-12-17
VENTENY,app.fortuna.venteny,f81daefd-9004-4aef-b77b-abd2cf7cda21,thalia,"appnya ngebantu bangeet buat kehidupan sehari-sehari! selain bisa buat ngisi pulsa & token listrrik dengan mudah, ada banyak jg diskon-diskon dari berbagai merchant 🥺 keren deeh!",5,2021-12-17
VENTENY,app.fortuna.venteny,0825e426-503b-4a2c-85c3-f6b8e6c65011,kuchiki yoant,Rekomendasi untuk anda jika mau menjadi agen voucher karena didalamnya terdapat fitur yang memudahkan.,5,2021-12-17
VENTENY,app.fortuna.venteny,f5dbb91d-781d-4a4a-a270-9649c66105d1,Satrio Aprilianto,Memudahkan banget ni kalau mau beli pulsa👍,5,2021-12-17
VENTENY,app.fortuna.venteny,ed8c15a7-9ec0-4506-9e6e-3c1ac512da28,Ahmad Lutfie,Aplikasinya bermanfaat banget dan seru tidak membosankan udh rapih ga berantakan fiturnya mantap,5,2021-12-16
VENTENY,app.fortuna.venteny,ca76e2ca-a731-46e4-ac59-af03a5026453,Hanis Zafira,Aplikasi ini emang yang terbaik dari yang terbaik... Semua pengeluaran dan pemasukan keuangan kita bisa di atur hanya di aplikasi ini... Bisa juga membeli kebutuhan elektronik yang kalian tidak usah keluar rumah lagi cuma aplikasi ini saja.,5,2021-12-16
VENTENY,app.fortuna.venteny,6b024abe-6dbc-4117-8dc7-5fcec8a84801,Lutfi Ad,Wah aplikasinya keren ngebantu bgt kebutuhan bayar listrikku,5,2021-12-16
VENTENY,app.fortuna.venteny,776d1ba9-191f-4595-bc76-f0d260613007,Lulu Imaroh Syahida,"Aplikasinya bagus banget, rekomen untuk di download. Disini banyak manfaatnya bisa untuk transaksi apa aja seperti pulsa,listrik dan lain-lain semua sudah dibungkus jadi satu dalam aplikasi ini. Udah didukung juga sama lembaga keuangan non bank yang terdaftar di OJK👍",5,2021-12-16
VENTENY,app.fortuna.venteny,510f9c1e-8bed-4d4e-b3f0-b49fff4105fc,Nurma Cahyani,"Aplikasinya keren, ngebantu banget buat pengguna baru.. Bayar tagihan listrik jadi mudah!",5,2021-12-16
VENTENY,app.fortuna.venteny,2d640155-d8f5-4874-ba3d-af55dcc9b288,2C_C21_054_Muhammad Hekmatyar Rabbani,Venteny oh venteny aplikasinya simple banget pendaftaran gak ribet gak tau mau ngetik apalagi. Pokoknya bagus deh hihihiii👍,5,2021-12-16
VENTENY,app.fortuna.venteny,adf238e5-db65-4621-aa4d-497380459e7a,Itawati 07,"Woaah si orange ini mudah sekali pendaftaran nya gak ribet, seger liat warnanya hehe dan membantu sekali untuk tabungan ewallet saya",5,2021-12-16
VENTENY,app.fortuna.venteny,3b3aeedc-3f4e-4920-83ea-bc3b13059c73,Nony Saputri,aplikasi yg sangat membantu. Bayar listrik tdk berlu repot,5,2021-12-16
VENTENY,app.fortuna.venteny,bee50ee3-7d72-44d3-85f0-afbbdd60c5cb,Allura Annabeth,"Aplikasi yang pas untuk keuangan kita nih... Mau transfer kemanapun mudah dan bisa kapan aja, bisa top up saldo venteny sampai pulsa loh.. Pokoknya wokeh deh",5,2021-12-15
VENTENY,app.fortuna.venteny,c2c20f44-d6c0-43f5-b707-892666022682,Sabila Alkanza,"Terbantu dengan ada nya aplikasi venteny, pulsa listrik abis tinggal top up dari venteny tanpa harus keluar rumah. Apalagi dimasa pandemi ini kita harus meminimalisir kontak dengan dunia luar, dan dengan venteny sangat membantu dalam segala pembayaran dari rumah. Terimakasih venteny 👍",5,2021-12-15
VENTENY,app.fortuna.venteny,f548a34f-1e44-46df-9b39-82c4049b88b8,Muhamad Basori,"Wew wew aplikasinya lumayan ngebantu buat aku yang mageran keluar rumah cuma buat beli kuota, buat developer next time fitur nya ditambahin ya",5,2021-12-15
VENTENY,app.fortuna.venteny,642ef057-766a-4669-bc00-7c3d360f273c,Haiqal Ida,"bawa uang banyak kemana mana ga perlu khawatir karena bisa di simpan di aplikasi ini, fitur untuk top upnya mudah banget.",5,2021-12-15
VENTENY,app.fortuna.venteny,5e1c092a-4401-4b24-a42f-2fd61df08b78,JACK,"Apk ini sangat memudahkan untuk transaksi seperti bayar listrik, pulsa, dll, mantap pokonya",5,2021-12-15
VENTENY,app.fortuna.venteny,60fc912a-ab7f-401c-87fc-d260d4de7325,muarif ichda,"Akhirnya nemu aplikasi yang aku cari selama ini buat bayar listrik, beli pulsa dll. Recommended bgt pokoknya. Mantulll",5,2021-12-15
VENTENY,app.fortuna.venteny,f3a8ada2-9195-46f7-afe1-5ce82bb8c62b,Nanda zora venerdi,"dompet digital yg aman dan bisa dibawa kemana mana, kalo lg urgent bisa bgt lngsng topup ewallet disini, recommended banget pokonyaa",5,2021-12-15
VENTENY,app.fortuna.venteny,438d3b42-450e-44f8-9fe2-92cc78960079,Eny Thabry,"Dengan aplikasi ini, mau bayar tagihan listrik, mau beli pulsa jadi mudah, ga harus keluar rumah. Membantu banget pokoknya.",5,2021-12-15
VENTENY,app.fortuna.venteny,4ddeee9a-5848-4f92-93b6-b129349115bb,Yanto Yes,"Ini aplikasi menunya banyak banget dan sangat memudahkan transaksi ku. Bisa top up ewallet ku, bayar wifi langganan, tagihan listrik dan masih banyak lagi. Top deh",5,2021-12-15
VENTENY,app.fortuna.venteny,95647e2a-a084-4fd5-a15f-b2bdfa827b29,Pandu Jaya,Apk yg paling banyak kasih promo2 cashback nih. Bisa jajan murah di Starbucks bareng temen tanpa kantong jebol🤣 Menu2nya disini juga helpfull untuk kebutuhan transaksi,5,2021-12-15
VENTENY,app.fortuna.venteny,5181f651-ea8f-4708-be3c-a9aa3edd9a2d,haickal dohan,"dompet digital yang sangat aman, dan jg bisa top up e wallet kesayangan, nyimpan uang tabungan disini pun bisa aman, recommended",5,2021-12-15
VENTENY,app.fortuna.venteny,4da55293-3cac-4d0e-bfb2-caa0c9d9612e,Widia Fatimah,"Puas banget sama pelayanan aplikasinya, apalagi saya sibuk dengan aplikasi ini bisa memudahkan saya untuk membayar listrik contohnya dan berbelanja lain nya🥰",5,2021-12-15
VENTENY,app.fortuna.venteny,91e70946-6802-4046-98b0-d532bafc77b9,28_Reghina Fakhira Salsabila,"Baru tau aplikasi ini, dan ternyata bagus banget aplikasinya. Membantu untuk melakukan transaksi secara online, jadi bayar tagihan ga perlu ribet keluar rumah. Ada promo-promo menarik juga",5,2021-12-15
VENTENY,app.fortuna.venteny,6274b08c-ee5b-459e-a164-09f14a370add,Khairul arifin,"Aplikasi bagus buat karyawan utk meningkatkan skill dg menonton vidio dan juga buat bayar listrik, pulsa, fitur nya banyak ga kalah ama sebelah",5,2021-12-14
VENTENY,app.fortuna.venteny,0d7d3821-0cae-4557-9532-53339b4ccb10,Aulia Novita Sari,Aplikasinya sangat bagus Dan tentunya aku terbantu banget karena bisa bayar pdam sama bpjs dari rumah tanpa keluar ongkos transport dong. Apalagi ada promo-promo menarik lainnya.,5,2021-12-14
VENTENY,app.fortuna.venteny,d0dea57e-7b24-4d5c-875b-fb105e217eee,Fransisca Astri Dianswari,"Aplikasinya sangat mudah digunakan. Dan tentunya sangat bermanfat untuk saya yang sering membeli pulsa dan kuota, sehingga di mana pun saya berada, saya tetap dapat mengisi pulsa dan kuota tanpa kesulitan",5,2021-12-14
VENTENY,app.fortuna.venteny,7993f814-9c23-4134-b82b-3def9b7905c9,P Yoto,Bagus suka banget karna transaksinya mudah dan cepat,5,2021-12-14
VENTENY,app.fortuna.venteny,0bc5e5e6-fad7-49d9-8a43-a62f934622ec,Fahyuni Asdiva Sari,Rekomendasi aplikasi yang bisa dijadikan rekomendasi untuk menjadi agen Vocher karena fiturnya yang bagus,5,2021-12-14
VENTENY,app.fortuna.venteny,8d45ef4a-5be1-43dc-9b8b-3984b29f3d4e,Atmhy Krisnawaty,"Aplikasinya sangat bagus dan bermanfaat,selain warnanya unik orange,temanya juga serasi dengan hp saya dan pengoperasiannya mudah dan tidak ribet🤗🤗",5,2021-12-14
VENTENY,app.fortuna.venteny,9288f8d6-4269-4b1c-86ab-5c8cc128d4ea,Parsimin 1980,"Warna aplikasinya unik orange, serasi dengan tema hp saya heheh, pengoperasiannya juga gak ribet👍",5,2021-12-14
VENTENY,app.fortuna.venteny,619c8464-c372-4579-a022-344299dd383c,Nur Yani,Keren bnyk promo menarik Bisa beli pulsa dan bayar tagihan listrik juga Memudahkan transaksi pokoknya keren,5,2021-12-14
VENTENY,app.fortuna.venteny,93e60630-eec1-4b5d-aa53-a5d0b8ad32b6,Ellia,"aplikasinya sangat bermanfaat, jadi klo mau beli pulsa dan bayar tagihan listrik ga perlu keluar rumah",5,2021-12-14
VENTENY,app.fortuna.venteny,0cf4ebc7-c4f7-4894-9d98-1e664bb62c48,Alya Setiana,Aplikasinya bagus fitur juga lumayan lengkap dan pendaftaran nya juga cepat good kedepannya ditingkatkan lagi yaaa👍,5,2021-12-14
VENTENY,app.fortuna.venteny,353837a7-4861-4830-b1e1-97163c631b90,Broken Faith,tampilan aplikasi dapat disesuaikan melalui menu preferensi,5,2021-12-14
VENTENY,app.fortuna.venteny,dadeaffb-3619-49c3-b09c-c1a810b3553e,Achmad ragil Alfiandi,"Aplikasinya lumayan ngebantu buat, warnanya aplikasinya juga cool serasi dengan tema hp aku 🤭",5,2021-12-14
VENTENY,app.fortuna.venteny,51d076f9-c530-4406-b50c-e256a75df588,Miss Dyandy,"Beruntung banget download venteny pas menjelang 12.12 kemarin. Promonya banyak banget, malah bisa ngopi starbucks hemat sampe 50 persen.",5,2021-12-13
VENTENY,app.fortuna.venteny,4cfb8303-61aa-43f7-a00f-7bd513a0d743,PP_009_JAKA APRIANDINATA,"Rekomendasi platform untuk yang mau jadi agen token, pulsa, dan lain lain, fitur didalamnya simple mudah digunakan.",5,2021-12-13
VENTENY,app.fortuna.venteny,3890abe8-375c-405b-a4ff-6e6b50793968,Wardhana Oke,"Sebagai pengguna venteny, saya merasa banyak terbantu jika ingin membeli kebutuhan sehari-hari, apalagi banyak promo promo menarik. Selain beli kebutuhan, gampang juga jika ingin membayar tagihan listrik. Hanya tinggal buka app ini sudh bisa melakukan bnyk transaksi. Top deh.",5,2021-12-13
VENTENY,app.fortuna.venteny,10304ca0-8bfb-4fdb-b9ac-6e88f4f5ae84,Chris Alexander,Pakai aplikasi ini banyak untungnya karena sering ada voucher diskon,5,2021-12-13
VENTENY,app.fortuna.venteny,bc583bd6-665d-4912-968d-f597385204c6,aku sebel,1 aplikasi ada banyak fitur Jadi sangat praktis.. Semoga sukses 👌👌,5,2021-12-13
VENTENY,app.fortuna.venteny,1c33056b-3e4a-4398-a654-5ff5345fe659,Chakim Nurrahman,Aplikasinya ringan fitur juga blumayan lengkap Proses transaksi juga lumayan cepat next time lebih ditingkatkan lgi ya aplikasinya,5,2021-12-13
VENTENY,app.fortuna.venteny,4bbd0c11-b42e-4fe8-8c4f-4ae0414bf3e5,RAMADANI DWI SAPUTRA,"Aplikasi cukup membantu penggunanya juga peraktis gak ribet, jadi gak perlu keluar rumah kalau mau beli pulsa dan pembayaran lainnya. Next time di tambahin fitur-fitur nya ya👍",5,2021-12-13
VENTENY,app.fortuna.venteny,2dda4eb7-91de-4879-91a8-89de822a7608,Bussiness Account 3,"Sangat membantu banget nih aplikasi, disaat-saat sibuk pulsa listrik habiss gak sempat mau beli, ada saran dari teman lewat aplikasi ini. Passs di coba lancar gak ada kendala👍",5,2021-12-13
VENTENY,app.fortuna.venteny,1f617b72-bf58-4e37-bec3-9df40430ce5b,hans channel,"Saya baru tau aplikasi ini ternyata sangat membantu sekali buat kaum rebahan seperti saya untuk membayar listrik, isi pulsa, pesan makanan dll",5,2021-12-13
VENTENY,app.fortuna.venteny,cb734417-2e23-4b8a-96e8-bd1a4b689966,Radya Putri,"Alhamdulillah ketemu venteny aplikasinya lumayan ngebantu penggunaannya juga gak ribet, next time diperbanyak lagi fiturnya yaa supaya lebih lengkap lagi. 👍",5,2021-12-13
VENTENY,app.fortuna.venteny,3159b3a6-fd48-4020-9740-4159db48b13e,Putra Badru tamam,Aplikasi yang sangat fleksibel dan menjadi salah satu solusi terbaik untuk orang yang bekerja di rumah. Di karenakan bisa melakukan pembayaran tanpa harus keluar rumah. Aplikasinya mantap,5,2021-12-13
VENTENY,app.fortuna.venteny,2c569ff5-c811-49f8-8867-3922de58ba97,Anjel Lina,"Aplikasi venteny nih membantu banget banyak banget promo2 voucher murah buat makan di starbucks gk cuman itu aja beli pulsa, bayar wifi bahkan ikut pelatihan pun bisa di aplikasi ini",5,2021-12-12
VENTENY,app.fortuna.venteny,4cd10b67-c20d-4cbb-a071-7c5c9503d7f4,Sifa Bella,"Mau beli kebutuhan pokok segampang ini sekarang, ga sia2 download aplikasi ini",5,2021-12-12
VENTENY,app.fortuna.venteny,4830c960-7394-4923-a927-f2a7c3c0a6f7,windi windi,"Aplikasinya bagus dan lengkap banget, cocok untuk Kalian Yang Males Keluar.Pokoknya ga bakalan nyesel deh kalau download aplikasinya karena ini recommended Banget🤗",5,2021-12-12
VENTENY,app.fortuna.venteny,8c8f2b53-8e82-49c0-9a67-23b7d5afb5b5,Hima Hima,"Sangat recommended nih buat kita yg suka mager , semua pembayaran cukup pakai aplikasi ini...",5,2021-12-12
VENTENY,app.fortuna.venteny,0f0e2bf1-eee2-4a01-b412-1a50ac150df4,Dzaki Uki,Aplikasinya lumayan bagus nih.. Cukup membantu untuk pembayaran online.. bisa buat bayar listrik/pulsa juga. jadi gak perlu repot kita ke bank/ATM...,5,2021-12-12
VENTENY,app.fortuna.venteny,6121fad7-3ce5-4ef5-9579-59b6c625812e,Fitra Nur Sofar,"Aplikasinya memudahkan saya bertransaksi gak perlu ribet cukup pakai apliaksi ini bisa bayar listrik,top up dan Dll keren pokonya",5,2021-12-12
VENTENY,app.fortuna.venteny,4e44917d-f23e-48bd-8d76-9e7fd304d0c6,ayu sekar,"Bayar listrik, top up, beli pulsa, bisa banget di app venteny. Fiturnya lengkap, gais",5,2021-12-12
VENTENY,app.fortuna.venteny,187ff38b-a01f-4d0f-b42e-0b7066b9fe60,Hehe Rehe,Apk yang bermanfaat memudahkan segalanya untuk bertransaksi. Semoga semakin maju,5,2021-12-12
VENTENY,app.fortuna.venteny,d8572260-d9d2-4e04-94e0-b6a6bacb3b92,mulyati 05,"Aplikasi nya bagus banget bisa beli pulsa, dan beli token tanpa harus keluar rumah, dan di dalam aplikasi nya juga banyak voucher promo promo yang menarik. Pokoknya aplikasi ini keren bangett",5,2021-12-12
VENTENY,app.fortuna.venteny,c433c665-3bad-422b-94ae-90a59b52fe55,Siti Bariroh Hermawan,"Aplikasinya mantep banget jadi bisa bayar tagihan dan beli pulsa dimanapun ga harus ribet. Mantull sekali pokoknya, udah gitu banyak promo2 😍",5,2021-12-12
VENTENY,app.fortuna.venteny,1f3ab19a-b8aa-43b1-8797-8a74613fca6c,Diah Kusuma,Bagus nihh bisa beli kebutuhan disini tanpa keluar rumah apalagi masa ppkm. Bayar tagihan listrik jadi lebih mudah dengan aplikasi venteny,5,2021-12-12
VENTENY,app.fortuna.venteny,f2536b27-f78a-4977-98ed-d8086dad87f3,muhammad fikrie,"Aplikasi yang sangat membantu untuk memudahkam segala aktivitas saya dalam kehidupan sehari"" sangat fleksibel & juga keren, saran saya sangat wajib aplikasi ini untuk di dowloand guna memudahkan dalama segala hal aktivitas kita😊, terimakasih Venteny😊",5,2021-12-12
VENTENY,app.fortuna.venteny,88f6c0b8-805c-448c-a72e-cd5059b6cf8b,Lastri Maryani,"Sangat keren nih aplikasi sangat membantu banget, saat-saat sibuk pulsa listrik habis lewat aplikasi ini teratasi. Yuk buat kalian download",5,2021-12-12
VENTENY,app.fortuna.venteny,d6dbb98e-0b98-40a7-b70a-5bbdbbb69c32,iin oxip,"Aplikasinya sangat bagus dan membantu sekali dalam memenuhi kebutuhan dalam fitur pembayaran listrik,fitur academy juga bagus ..mantap betul pokoknya",5,2021-12-12
VENTENY,app.fortuna.venteny,c9999fa0-92ce-49c1-9ea2-c0864a739f92,anggi novitas,Aplikasi yg multifungsi dalam segala pembayaran. Untuk yg nau bayar bayar tanpa ribet boleh langsung download,5,2021-12-12
VENTENY,app.fortuna.venteny,61600515-e4db-42c3-abfa-8d0bdd45d51a,Agata Abigail,"Transaksi aman untuk tagihan serta proses cepat, ga banyak kendala selama proses jadi enak buat transaksinya",5,2021-12-12
VENTENY,app.fortuna.venteny,616f3c98-f0b3-4213-a4f6-2d8497448f72,Alenzo Keith,"Tadinya ga berharap terlalu tinggi sama aplikasi ini, tapi begitu nyoba pake bayar tagihan dari sini ternyata ok juga kok aplikasinya, cara pakenya juga mudah ga bikin pusing, dan proses pembayaran untuk tagihan pun cepat",5,2021-12-12
VENTENY,app.fortuna.venteny,5a305a3e-ed7c-4c55-a679-866a078a47cf,Rendy Rolla,Wah aplikasai mantap sekali....,5,2021-12-12
VENTENY,app.fortuna.venteny,d07401b7-c3a9-4787-8fa6-de7ad70406df,Jeki nurmitasari,Aplikasinya mantap bgt si. Bisa buat beli pulsa disini... harganya juga lumayan terjangkau😁,5,2021-12-11
VENTENY,app.fortuna.venteny,58cbb696-1cc7-4ddb-a070-ee6554af8b52,Ahmad Radit,Apk venteny ini membantu sekali deh bisa beli kouta disini dengan harga miring ketimbang beli di konter rumah. Aplikasinya juga simpel gk bingung makenya,5,2021-12-11
VENTENY,app.fortuna.venteny,becd28aa-fdd6-42f4-8695-9e46b33d9cbc,oen dandelion,saya pernah mengalami aplikasi yang loading cukup lama saat membuka halaman utama tapi setelah ditunggu sekitar satu menit akhirnya terbuka juga tidak sampai crash mungkin memang sedang ada proses di background,5,2021-12-11
VENTENY,app.fortuna.venteny,e525281f-59c9-470e-aada-eb051483bc8d,Ih Kepo,"Pertama tau aplikasi venteny itu disaranin sama temen,penasaran,pas coba aku download ternyata emang seenak itu aplikasinyaaa Cocok banget buat aku yang mageran buat bayar segala keperluan dan transfer ke orang tua tanpa ribet Pokoknya terimakasihh bangett buat venteny dabestttt aplikasinya",5,2021-12-11
VENTENY,app.fortuna.venteny,f8a58723-56d6-41f5-9c75-943da417e2ed,Nisza Nurul,Aplikasi nya recommended banget banyak fitur-fitur yang bermanfaat untuk bayar bayar jadi lebih mudah,5,2021-12-11
VENTENY,app.fortuna.venteny,d20f1d60-44a1-44ed-8936-0d9c1a83a361,Muhammad Syarif,"Zaman semakin modern dan maju, salah satu buktinya ialah dengan adanya aplikasi ini, satu apk bisa buat bayar macam² kebutuhan seperti listrik, air, dan lainnya, alhamdulillah permasalahan menjadi lebih simpel dan mudah terselesaikan...",5,2021-12-11
VENTENY,app.fortuna.venteny,5956215b-089a-4036-8c8f-d1e86b689368,ramadhani rozak,"Barumake, tapi puas.. membantu sekali but ngontrol keuangan hehe isi isi & bayar bayar jadi gampang ga ribet.",5,2021-12-11
VENTENY,app.fortuna.venteny,ef7ede87-a16a-4a18-9821-fbe4d661201a,Alfa 1,Sangat lengkap mau bayar apa pun gausah keluat rumah ..mantap,5,2021-12-11
VENTENY,app.fortuna.venteny,f2f9455a-0f78-4e96-9af1-d08691afdbad,Sarah Ratih,Fiturnya lengkap tampilan aplikasinya juga menarik mudah digunakan,5,2021-12-11
VENTENY,app.fortuna.venteny,aab230c3-0200-4279-bb66-d1ebc06c0e72,Putri Asli,"Aplikasi sangat membantu buat isi pulsa sama kuota, memudahkan banget deh pokoknya. Mantull",5,2021-12-11
VENTENY,app.fortuna.venteny,6309015d-a4be-43af-b2ad-a922e3c91bbc,ade d,Applikasi bagus lengkap fiturnya ada learningnya juga,5,2021-12-11
VENTENY,app.fortuna.venteny,9c61eee3-4ed0-4f44-8fb7-45af0df1d20d,Ahmad Nuruddin,"Lumayan buat kebutuhan beli pulsa disini, bisa hemat banyak",5,2021-12-10
VENTENY,app.fortuna.venteny,c952b906-5f6a-4442-b2e9-344a746fcc4b,Dwi Ata Yulia,"Proses verifikasi cepat, tisak menghabiskan memori, sejauh ini traksaksi masih lancar",5,2021-12-10
VENTENY,app.fortuna.venteny,99893572-8ef9-440b-931d-02ad37c45bae,Rafli Rangga,"Aplikasinya keren membantu aku dalam membeli pulsa, top up ,bayar listrik dll,gak download nyesel",5,2021-12-10
VENTENY,app.fortuna.venteny,19c8e0f9-3090-4e8d-9224-4092c042ffc3,Gondo Gondo,"Dengan plikasi venteny bayar listrik,isi pulsa, paket data dan lainnya bisa dalam satu aplikasi.Ukurannya juga kecil jadi tidak memakan banyak ruang di HP kita",5,2021-12-10
VENTENY,app.fortuna.venteny,05f86212-8c65-48fb-a6fe-d0807f43fc45,Ahmad Miftahul Khoiri,Wah saya selaku karyawan swasta sangat terbantu dengan menggunakan aplikasi venteny ini.,5,2021-12-10
VENTENY,app.fortuna.venteny,49f4ec13-cc13-44dd-bfa3-3e1cd8f6a593,Ary Yostiadie,Aplikasi sangat membantu buat yang lagi mager kemana-mana. Aplikasinya lengkap dan mudah jadi ga usah ragu.,5,2021-12-10
VENTENY,app.fortuna.venteny,95ca7911-f74f-4a01-ac61-2e87a492c83a,Indra Gunawan,Venteny aplikasi yang ngebantu banget buat saya yg mageran..cocok pisan suka banget pkknya..,5,2021-12-10
VENTENY,app.fortuna.venteny,2ee80a7e-80ad-4d04-929c-301625477e7d,ROya Robin,"Alhamdulillah aplikasi yg bermanfaat banget, bisa bayar semua transaksi bulanan, harga bersaing, dan terjangkau, kalian harus download",5,2021-12-10
VENTENY,app.fortuna.venteny,a1c0dfa7-7865-4bcf-b856-968cbca6dd1b,Ronaldo Smith,"Dapat rekomendasi dari saudara,ternyata aplikasinya bagus banget,memudahkan dalam bertransaksi digital saya,,sekarang akan saya rekomendasikan lagi untuk anda..mantul deh",5,2021-12-10
VENTENY,app.fortuna.venteny,fc58f537-1b33-4cc8-be3d-44f056375030,Shanice Farasya,App keren bisa top up dan bayar tagihan di satu app..,5,2021-12-09
VENTENY,app.fortuna.venteny,b27955e9-7633-4b43-b058-bd45add55e4f,rahma wati,"Aplikasinya mudah digunakan,kita bisa bayar tagihan listrik,bayar top up,mengisi pulsa serta paket data dalam satu aplikasi.Cocok juga untuk usaha jualan pulsa",5,2021-12-09
VENTENY,app.fortuna.venteny,d91fa96c-7b75-4569-887c-c139d3caa258,Husni Basroni,Terbantu banget saat isi pulsa bisa langsung beli disini tanpa keluar rumah dan ribet deh,5,2021-12-09
VENTENY,app.fortuna.venteny,56e1c399-740f-444c-927d-90dfe0c5cebf,Essenzo,Awalnya emang cuma iseng sih download venteny. Tapi aku rasain ternyata banyak manfaatnya juga. Oke kok fitur²nya,5,2021-12-09
VENTENY,app.fortuna.venteny,1d731d1a-55d6-4268-808a-b6b32d0d589a,Dani Ramadhan,"Aplikasi ini sangat membantu untuk para karyawan. Fiturnya lengkap dan bervariasi. Apalagi di fitur V Academy, udah ada penawaran skills sharing online platform bagi karyawan, jadi makin memotivasi untuk meningkatkan skill dan ketrampilan kerja. Kalo butuh dana darurat pun, ada fitur V-nancial, jadi memang aplikasi ini bermanfaat banget.",5,2021-12-09
VENTENY,app.fortuna.venteny,36781d64-8bb8-484b-b162-d0e0c61e85c3,Alfarobert Zefanya,Venteny bisa menjadi solusi buat yang malas keluar untuk melakukan pembayaran dan beli pulsa Semoga semakin inovativ dan berkembang Keren......,5,2021-12-09
VENTENY,app.fortuna.venteny,28df86fa-47bb-4a1f-968d-7e7a83211f72,acip ali prihantono,"Aplikasi yg cucook bingit, byr listrik dll ga perlu keluar rmh, cukup dri hp az Joooos gandos Pokoke mantul mantaabs betuuuul!!!!",5,2021-12-09
VENTENY,app.fortuna.venteny,ccc5424b-46b9-42bb-9724-34dab85d2930,Wawan Purwanto,Aplikasi pembayaran yang mudah di gunakan untuk membayar seperti Kouta maoupun pulsa sangat terbantukan pakai aplikasi pembayaran ini dan saya recommended kan.,5,2021-12-09
VENTENY,app.fortuna.venteny,fcd0142d-caf2-43ec-b467-46798a4cc270,Winara Anandya Putri,"Aplikasinya bagus, lebih bagus begitu diupdate, cara bikinnya akunnya hampang, bisa buat bayar bayar tagihan ato pulsa lah",5,2021-12-08
VENTENY,app.fortuna.venteny,d5458147-0168-41ee-bab9-bbd85ab35467,Wiwi Wijayanti,"Aplikasi yang bagus banget, fitur nya juga bagus apalagi yang suka jualan. Wajib banget punya aplikasi ini.",5,2021-12-08
VENTENY,app.fortuna.venteny,4228fcb7-3f86-4c9e-b785-dcb2714fd8b1,Farichah Isnaini,"waaah, ada aplikasi baru memudahkan buat transaksi apapun, bisa nih buat bisnis 😍😍😍 jual pulsa dan jasa isi saldo2 digital 🤤🤤🤤",5,2021-12-08
VENTENY,app.fortuna.venteny,3c0c032b-ed12-48f9-b9aa-88d5d497a147,Vallentino Prayudha,"Pertama kali saya mencoba aplikasi ini sudah bagus, banyak fitur yang ditampilkan, terutama keunikan fitu otomotif serta Edukasi, namun alangkah lebih bagus lagi jika ditambahkan fitur top-up untuk game mobile, PC, console, dan sejenisnya agar kita pengguna Venteny juga bisa lebih dipermudah dan lebih sering memakai aplikasi ini.",3,2021-12-08
VENTENY,app.fortuna.venteny,c5567ade-b901-400c-bea5-bbe4aed0c9c1,Rizal Alfuadi Munajat,"Aplikasinya bagus, memudah dalam aktivitas saya seperti top up, bayar listrik,dll,",5,2021-12-08
VENTENY,app.fortuna.venteny,7a57b6ee-5daa-4d3f-a591-52757464f885,Yusriawati Cut Meurah,"Aplikasi yang lengkap banget. Cocok untuk saya yang males kemana-mana. One stop solution dalam satu aplikasi, bisa utk bayar macam-macam kebutuhan, mulai dari bayar listrik, air, sampe beli makanan juga bisa. Keren, harus pinya aplikasi ini di hape.",5,2021-12-08
VENTENY,app.fortuna.venteny,75c96e43-3809-49b6-966b-d334fea517f5,Ghannia Zefanya,Aplikasi yang bagus untuk mengakomodasi kebutuhan perusahaan,5,2021-12-08
VENTENY,app.fortuna.venteny,40bdd889-5fca-4a21-951d-394def3e3e4b,Rayi Nanda,"mulai dari bayar tagihan ,topup ewallet semua ada disini .. recomEnded buat hp yang memoRy kecil 😂😂",5,2021-12-08
VENTENY,app.fortuna.venteny,73da21cf-0f91-4ca4-a44d-ca95a03e5eb7,Albi Yudha Pratama,Halo .saya pengguna venteny sangat terbantu dengan adanya apk ini. Top up pulsa jadi semakin mudah .cepat,5,2021-12-08
VENTENY,app.fortuna.venteny,69d8f225-b71e-4da0-a581-d7cd26a6716c,muhammad Juki,Apknya lancar tidak lag dan banyak fitur fitur yang bagus kedepanya semoga lancar truss..,5,2021-12-08
VENTENY,app.fortuna.venteny,0d84ec7d-6274-4002-a737-d66b1b778862,Elsa Diah,"Recommend bgt deh...aplikasi yang sangat membantu ,mempermudah kita untuk bayar tagihan listrik pulsa dll..jempol deh buat ventiny",5,2021-12-08
VENTENY,app.fortuna.venteny,168005e0-fd10-4e77-a28c-3cc8fb45983d,Ulul Anim,Baru dapat rekomendasi aplikasi venteny dari saudara katanya bagus dan ternyata benar-benar bagus dan canggih banget.... semua kebutuhan elektronik yang kita butuhkan bisa di aplikasikan di sini nggak perlu keluar² rumah lagi...,5,2021-12-08
VENTENY,app.fortuna.venteny,7166a016-eca7-44a5-bed3-22a9940be9cf,Diana Kekasihku,"Aplikasi yang sangat membantu dan mempermudah segala urusan pembayaran, disamping itu juga bisa untuk top up pulsa hp maupun listrik. The best banget 👍",5,2021-12-08
VENTENY,app.fortuna.venteny,0f21ed5f-8e0f-4390-979e-301589f4ed34,Muhammad Lukman Hakim,"Mantep sih apknya, pembayaran jadi satu aplikasi. Mau beli pulsa, topup, bayar listrik jadi simpel gaperlu keluar rumah",5,2021-12-08
